Date;Tweet Text;Tweet ID;Screen Name
11/08/2020 20:10;It seems that the forces of Twitter don t like my account I assume because they still believe in the FALSE narrative that Trump is somehow Putin s lapdog Well Jack Dorsey co your lies are self evident ;1293354163494158337;@Kurt43112867
11/08/2020 20:10;The people Main Street and evening Wall Street are excited about Biden Harris vs Putin Trump and their enablers and sycophants RT CNBC Wall Street leaders on Tuesday cheered Joe Biden s selection of Sen Kamala Harris as his running mate in the presidential election ;1293354160201576448;@NorRegnal
11/08/2020 20:10;Putin Approves First Covid Vaccine Even as Trials Go On ;1293354124117909506;@cestleiden
11/08/2020 20:10;Putin says Russia has registered a coronavirus vaccine but doubts over safety remain;1293354108951330822;@Posicho
11/08/2020 20:10;Talk to your buddy Putin maybe he can help you fucking traitor to the USA worst president in history and dumbest ever;1293354047387377664;@harlanhayes78
11/08/2020 20:10;Coronavirus Putin says vaccine has been approved for use;1293354029993558021;@rbiolena
11/08/2020 20:10;OAN operated by the kremlin why do Trump supporters love Putin so much RT MontyBoa PiperK Which is why CNN dropped its coverage No more free rally coverage for POUTS We re tired of his lies and propaganzas ;1293354013069459457;@Rick63618377
11/08/2020 19:20;Vladimir Putin is a shitty human and this brief story tells of his recent adventures He cried over fake news then he lied repetitively then he went home to play golf check twitter and sob alone on the toilet ;1293341660219412481;@bot_london
11/08/2020 19:20;Putin already made his daughter get the jab RT mfa russia President Putin The COVID vaccine forms stable antibody and cellular immunity I know this very well too because one of my daughters has got this vaccination She feels well ;1293341650022887424;@Gvenechka
11/08/2020 19:20;Trump thought Harris was extraordinarily NASTY he loves that word to kavanough She was doing her job and very well I might add Putin will not be cut any slack with her that is for sure ;1293341648835866624;@LuvWestCounty
11/08/2020 19:20;But listen to this and they are still voting for Biden even if he picks her Think on that literally no one nothing can be worse Putin OJ heck Satan etc than Trump Pence to these two guys I just have to wonder how many closed minded voters are on both sides RT gummibear If you are not familar with potential President vice for now Kamala Harris have a listen to this exchange When I heard it I thought she was toast Total lack of judgement by Biden Joe Rogan Experience Josh Dubin Jason Flom;1293341617513005057;@dryleveedude
11/08/2020 19:20;Trump is going to make a deal with Putin for his vaccine and he ll be pushing it like hydroxychloroquine People will be taking it Don t be one of them ;1293341594062589952;@TheWhitneyBrown
11/08/2020 19:20;My thoughts exactly And trump saying it will disappear like he knew putin had the vaccine I feel like a crazy person but I do wonder about this as germ war fare by Putin RT Hillaryh Hos Explosion at Russian lab known for housing smallpox virus CNN Is it just me or does anyone else wonder about the Russian virology lab blowing up just before coronavirus spread Covering up the trail Now Putin has first vaccine ;1293341578958798849;@merrill2n
11/08/2020 19:20; yrs ZERO SCANDALS OUT OF BUSH RECESSION UNEMPLOYMENT FROM TO Oh yeah Guiliani has dirt LMFAO manufactired dirt courtesy of Putin What a joke time to fight our nation is at stake VoteBlue;1293341478316638208;@mccunecicki
11/08/2020 19:20;This is the equivalent of Putin s window RT joshdcaplan DAILY MAIL Ghislaine Maxwell taken off suicide watch in Brooklyn jail;1293341470238408706;@KealanBurke
11/08/2020 19:20;Vladimir Putin made headlines when he announced that Russia had developed the world s first COVID vaccine He insisted it had passed all needed checks despite the fact it hasn t undergone phase trials a fact that has horrified vaccine experts ;1293341458293022727;@thedailybeast
11/08/2020 19:20; disse a Putin ha RT g Putin anuncia que R ssia o primeiro pa s do mundo a registrar vacina contra o novo coronav rus G ;1293341454123896833;@melaniemagdalle
11/08/2020 19:20;There would be no more fitting garnish to this shit sandwich of a year than if Vladimir Putin became the hero ;1293341438579740672;@BroBible
11/08/2020 19:20;Russia did not release scientific data to back up the claim Sputnik V is safe and reliable but Putin said his daughter got the vaccine ;1293341428110761984;@OKCFOX
11/08/2020 19:19;There is NO RUSSIAN VACCINE for Trump Vlad goes for the killer punch before he cuts Trump loose He s decided to abandon Trump Putin s too smart to get stuck with a complete LOSER RT StevePasquale The Bots are out in full force tweeps If they just joined twitter and have virtually no followers they re Russian bots Lots of em coming outta the woodwork to sow discord Block report keep pushing Ps Fuck you Putin ;1293341398914068482;@AshColben
11/08/2020 19:19;I may trust Putin with a vaccine over BillGates or Fauci The choice still is no vaccine;1293341371831590913;@striperslayer77
11/08/2020 19:19;What Putin Wants To Tell Us About Advent It s Troubling;1293341362331553793;@EvangeliTron
11/08/2020 19:19;Yes absolutely in contrast with the Russian ticket composed by Trump his cheerleader VP and turtle McConnell partner to Oligarch Deripatska close friend to Vladimir Putin the presidential advisor or supervisor to President Trump and CowardBadRepublicans RT glennkirschner Biden Harris is a strong ticket An honorable ticket An experienced ticket A kind caring ticket Biden Harris is an American ticket ;1293341342396014592;@GregorioMeraz1
11/08/2020 19:19;Strange here we are thinking Trump epstein putin china RT EWErickson Harris Biden Hillary Epstein ;1293341338327556098;@TheSecondBag
11/08/2020 19:19;Putin Pulls an August Surprise With His COVID Vaccine Approval Announcement;1293341336842776581;@Libertarian_Hub
11/08/2020 19:19;Vladimir Putin blew every bloody Yoda s chode off and they oofed on it ;1293341241078419460;@DanielKeemBot
11/08/2020 19:18;Russia may have a vaccine for Covid Putin tested it on his daughter Goes to show you communists will definitely put their own children in peril REMEMBER THIS as long as trump remains in that W H Just saying ;1293341140389773312;@MykeKING8
11/08/2020 19:18;vladimir putin added me on facebook;1293341126745903106;@aaannawiggins
11/08/2020 19:18;I m willing to bet that Putin isn t laughing today The villagers are storming Frankenstein s castle with their torches and pitchforks BidenHarris ;1293341091975004166;@SupermanHotMale
11/08/2020 19:18;Let s see if the inept one in the White House takes the bait and praises daddy Putin for the phony covid vaccine story Russia is pushing thehill WHO CDCgov;1293341082642608128;@1world1goal
11/08/2020 19:18;Does putin keep all his GOP stooges on a leash A vote for any republican is a vote for more treason RT RepDougCollins JoeBiden quick question Does KamalaHarris have to stay with you in the basement or does she have to get her own ;1293341077433270272;@ecorse1
11/08/2020 19:18; RussianRoulette and first past the post is the game here absolute risky business Russia approves world s first coronavirus vaccine Vladimir Putin covid russia covid The New Daily;1293341053697667072;@suzlette333
11/08/2020 19:18;Yes Biden picked Harris but who didn t see that coming Don t let partisan politicking distract you from very real world events Russia is speeding ahead with a vaccine that hasn t been thoroughly tested Trump is tweeting about his total trust in Vladimir Putin ;1293341044763791362;@badseedbook
11/08/2020 19:18;Putin s daughter took it so it s got to be fine right COVID RT axios Anthony Fauci says on National Geographic discussion on Russia s coronavirus vaccine I hope that the Russians have actually definitively proven that the vaccine is safe and effective I seriously doubt that they ve done that ;1293341044000595969;@JonBelsher
11/08/2020 19:18;Russia registers virus vaccine Putin s daughter given it via politico;1293340993706700806;@CarlRobuck
11/08/2020 19:18;President Putin claims that Russia has registered the world s first coronavirus vaccine before completing so called phase three clinical trials ;1293340973171433474;@NBCNewsWorld
11/08/2020 19:18;Compare and contrast Joe Biden picked Kamala Harris as his running mate Paul Manafort picked Mike Pence as Putin s running mate ;1293340947812679686;@rashaverak_day
11/08/2020 19:18;Trump magically has a cure after Putin announces it Yet the Virus was created by China supposedly who s paying attention out here ;1293340935309451265;@CallinUOut7
11/08/2020 19:17;Putin and the GOP when you black twitter idiots start talking about how y all aren t voting;1293340913230589953;@mrc__suavee
11/08/2020 19:17;Putin s vaccine I would never inoculate that into my body I hope his daughter a recipient of the vaccine do good ;1293340826383323137;@Leonarda2020
11/08/2020 19:17;I just hope that Trump gives Putin all of his personal money and goes bankrupt again on his way out of the White House then he will be Loser Loser RT DavidJollyFL This Putin vaccine thing is all about him giving the alleged science to Trump so the President can take personal credit for a vaccine ahead of the U S elections ;1293340798075965442;@SixDegrees9
11/08/2020 19:17; Trump v Putin A Vaccine Manhood Contest by Peter Baker via NYT Afghanistan;1293340769932193800;@AfghanHerald
11/08/2020 19:17;Lord Putin ;1293340758561263617;@Mary_Montijo
11/08/2020 19:17;The ONLY WAY Russia Putin could have developed a vaccine is if they had developed the SARS COV virus in the first place and infiltrated it into China ;1293340720418271233;@call_me_tomasso
11/08/2020 19:17;Who in their right mind would trust anything from Russia regarding Covid Vaccines Anyone Putin is attempting to turn a coronavirus vaccine into the new Cold War;1293340706845495296;@HomesinLA2
11/08/2020 19:16;Trump s good buddy Putin claims to have the cure for the Coronavirus;1293340662478196736;@ImpeachTrump012
11/08/2020 19:16; Try it says Vladimir Putin Try what You ask This he says turning a syringe over gingerly in his hands I tested it on my daughter ;1293340656874729473;@SaoSasha
11/08/2020 19:16;From now till November rd for everything you see on social media first say to yourself would Putin like me to believe this If so question it ;1293340594748690432;@MaraEinstein
11/08/2020 19:16;How long until Agent Orange Trump hails his boss Daddy Putin s dangerous and untested COVID vaccine as a miracle cure ;1293340581440020480;@ImpeachTrump012
11/08/2020 19:16;Putin Trump vaccine consists of vodka and disinfectant in unequal parts;1293340575177912320;@DeseaDes
11/08/2020 19:16;I will trust this only when Vladimir Putin gets a jab of this COVID vaccine then do a challenge trial himself personally like a brave Russian warrior would if not it s all just frou frou talk Coronapocalypse Russia RussiaVaccine;1293340521226571778;@faradisation
11/08/2020 19:16;No phase trials No phase trials No tests for safety No tests for effectiveness No data published Putin Russia coronavirus vaccine in a nutshell ;1293340493808635904;@supersaadx3
11/08/2020 19:16; No Of course not It skipped large scale testing It s Putin RT CNNPolitics Russia claims a win in the vaccine race But would you take a vaccine from Vladimir Putin Analysis;1293340484245413888;@PoliticalTeacup
11/08/2020 19:16;Putin tested his vaccine on journalists calling it a win win situation ;1293340466893660160;@ModestoBeek
11/08/2020 19:16;Poor Bart O KKKangaroo The Black Lady WAS MEAN TO HIM RT Acyn Trump She was extraordinarily nasty to Kavanaugh;1293340457834086402;@donald_j_putin
11/08/2020 19:16;Heiiiii Wait a minuteeeee im smell like conspiracy Putin Corona VaksinCovid updates Indonesia;1293340442457542656;@abdullah_ablers
11/08/2020 19:16;Looking forward to BidenHarris to destroy the pathetic Putin wanna be and his weak little ass kissing evangelist TrumpIsACompleteFailure BidenHarrisForTheWin RT look goodinppl BidenHarris Joe Biden selects Senator Kamala Harris to be his vice presidential running mate;1293340431296561152;@AndrewNancarrow
11/08/2020 19:15;Finally a ray of home ;1293340382952976384;@ShakyaKshitiz
11/08/2020 19:15;CRIMINAL CROOKED CORRUPT trump and his cronies are FUCKING UP OUR COUNTRY AND CONSTITUTION EVERYDAY THE OLD CRIMINAL IS A LOWLIFE A DEVIL DUMB LOW IQ PUTIN S POPPET TRUMP CHINA VIRUS PRODUCER CEO OFF TRUMP UNIVERSITY A KILLER AND A PATHOLOGICAL LIAR DIRTY TRICKER ;1293340321737310209;@nee_luly
11/08/2020 19:15; Russia has put a claimed vaccine into a Ph registrational trial Apparently it has given the equivalent of accelerated approval to this claimed vaccine No published data about safety or efficacy from Ph trials COVID MRNA PFE BNTX;1293340318834683904;@SoundVU
11/08/2020 19:15;I would NEVER believe a word this lying jackass tries to tell America Sick of the lies sick of the corruption sick of GOP kowtowing to Putin and the NRA VoteThemAllOut RT senatemajldr The Speaker Democratic Leader say not another dime for testing treatments or vaccines unless they get a huge tax cut for blue state millionaires Taking our health system hostage over longtime non COVID related liberal demands This is a crisis Let s govern like it ;1293340291504644099;@davidwferrell
11/08/2020 19:15;Russia have made its coronavirus vaccine announced by putin Putin s daughter got vaccinated Finally a new hope of getting back our normal life RussianVaccine;1293340268180250624;@Sheikhabubakr6
11/08/2020 19:15;PUTIN FOR THE WIN ;1293340220767666182;@PeterPolites
11/08/2020 19:15;India is among the countries that have expressed interest in obtaining the new coronavirus vaccine announced by Russian President Vladimir Putin ;1293340169723170819;@news18dotcom
11/08/2020 19:14; Referring to Putin s divorce in he asked the surprised politician Do you see women close to our president no maybe because Putin is into young boys ;1293340142137159681;@FitzInfo
11/08/2020 19:14;Russia approves COVID vaccine Sputnik V before final trials putin;1293339989825257479;@calgarysun
11/08/2020 19:14; Philippines president Rodrigo Duterte offered assistance to Russia in clinical trials and local production of the coronavirus vaccine I will have it injected to me in front of the public president Duterte said;1293339963904401408;@Nieczuja_clan
11/08/2020 19:14;Wide Putin with the vaccine;1293339948351979521;@isaac_mearns
11/08/2020 19:14;Incredibly reckless for Putin to endorse a COVID vaccine that has not been thoroughly vetted Can someone please explain to me why people support politicians who undermine science ;1293339920011067392;@mbrookswilson
11/08/2020 19:13;GOP are being taken over by the Vladimir Putin Government Of Putin World RT GOP The Democrats are being taken over by the radical left realDonaldTrump;1293339871139037184;@nodirtpolitics
11/08/2020 19:13;Coronavirus outbreak latest Aug Here are the latest updates from Japan and beyond on the coronavirus outbreak As of p m Tuesday Aug Japan time President Vladimir Putin said Tuesday that Russia has become the first country i ;1293339745737728001;@33newsking
11/08/2020 19:13;NY Times Trump v Putin A Vaccine Manhood Contest;1293339741321080837;@stat_butler
11/08/2020 19:13;November please hurry Putin s puppet needs to stuff it RT pattonoswalt good;1293339716364824576;@charles87599249
11/08/2020 19:13;How many more reasons do you need to DeleteFacebook Facebook is just a front for Putin IMO Zuckerman does his best to destroy democracy and hurt the USA RT Netmeetme Revealed QAnon Facebook groups are growing at a rapid pace around the world DeleteFacebook;1293339666976890881;@Jasper_cat44
11/08/2020 19:12;People ask are they legit Our partnership friendship trust camaraderie Yes Vladimir V Putin describes it another way which is sweetest anyone has ever said Asked by someone Are you related No not related she is Kindred Spirit UPDATE ;1293339641664413704;@IvoryPearlMusic
11/08/2020 19:12;Someone needs to ask him about his boss Putin upstaging him with a vaccine RT stretchdogg StevenTDennis gtconway d Someone needs to ssk realDonaldTrump about this donation at the next CV hearing since they never discuss CV ;1293339627353513987;@atlgeeman
11/08/2020 19:12;Loyal to Russia in love with Putin but his clothing is made in China Some ppl can t be trusted to tell the truth he claims he helps American workers Not true He helps Putin and the Chinese workers OneV trumpputin MadeinChina;1293339621217243143;@7711irwin
11/08/2020 19:12;Putin announces Covid vaccine;1293339610572095488;@NargisHamayun
11/08/2020 19:12;The U S Media should handle Biden Harris the same way they handled Putin TrumpPence in Zero Vetting and keep shouting But Her Emails ;1293339594667069440;@YvetteJiselle
11/08/2020 19:12;Putin says Russia has approved world s first coronavirus vaccine for use;1293339594633678851;@rhodaks1
11/08/2020 19:12;Everybody want a Covid vaccine till they realize Putin was the first to get one;1293339513234821122;@DJSublime99
11/08/2020 19:12;Biden and Harries the where not the ones in charge to let over thousand Americans die or Kiss Putin s butt we will Remember who was in charge;1293339507308269572;@hanneloreursula
11/08/2020 19:12;Putin ain t got nothin on Kamala ;1293339503046713347;@ReginaL2020
11/08/2020 19:12;Trump angrily denies trusting Putin over sleazebags in US intelligence;1293339484336005120;@MaureenMannion2
11/08/2020 19:12;Called Sputnik V RUSSIA HAS A COVID VACCINE JustTheNews OANN realDonaldTrump foxandfriends FoxNews TuckerCarlson PressSec Why is no one reporting this Putin vs Gates which vaccine do you trust more DemocratFed LotusOak RealCandaceO ye brentonwoodsresearch;1293339454204252160;@Victor48355670
11/08/2020 19:12;Putin is on tendencies lol;1293339421891334145;@PFringed
11/08/2020 19:11;Republicans know it s over Even Putin can t stop what s coming They re stealing as much as they can and sending billions to their donors in a last ditch effort to maintain power They will blame everything on Trump It won t work They think they ll get a pass Not gonna happen ;1293339411380424706;@hill55willie
11/08/2020 19:11; WE allow him to be What s this we PutinsPuppet PutinsGOP;1293339383152640001;@TheMattSalzberg
11/08/2020 19:11;Wow Dream ticket Listen up Trump Putin You guys should consider calling it quits You aren t going to look too good in the next few months It is what it is RT HillaryClinton I m thrilled to welcome KamalaHarris to a historic Democratic ticket She s already proven herself to be an incredible public servant and leader And I know she ll be a strong partner to JoeBiden Please join me in having her back and getting her elected ;1293339351573700614;@AnthonyLeePope2
11/08/2020 19:11;Come on Man Putin is waiting for the American Vaccine to give to himself and his family He s no dummy It s really I hate you for loving you AmeriKa Long Live Dr Fauci cenkuygur FauciFan RT cenkuygur If Putin is so convinced that his vaccine works why didn t he take it Why did he make his daughter take it instead Monster;1293339332259065856;@JRDarius1
11/08/2020 19:11; Today for the first time in the world a vaccine against the new coronavirus was registered Vladimir Putin Russian President;1293339311744659457;@OmoOduaRere
11/08/2020 19:11;The Cold War has been fought over Arms Space travel and now The new Cold War on Vaccines ;1293339298985422848;@chriskc_Lee
11/08/2020 19:11;Putin got his brexit Lets not give him access to the motherload of an oil find too Must keep ssnctions;1293339272658006017;@kimbfalcone11
11/08/2020 19:11;Trump Slams Bolton as One of the Dumbest People Over Claims He Trusted Putin;1293339219914522631;@realGoyRogers
11/08/2020 19:11; million per hour That s more than Putin spent per hour on Facebook in RT ShaneGoldmacher NEW ActBlue processed more than million in donations between pm and pm;1293339202537566208;@AgTerzo
11/08/2020 19:11;tRUMP putin crying Why do I care about Devos not being able to pay all her yacht fees Charter School take tax dollars still make parents pay Why does it take a pandemic to get all children in US tablets GOP still ain t got a plan for that reality Dullards;1293339176205770752;@asbell3etdvelt
11/08/2020 19:11;Soooo is this where the new vaccine came from If so did Putin promise Tremp a cut of profits to let them rush it to market and sell him a few bil worth ;1293339166646743040;@robingrearson
11/08/2020 19:11;Russian President Vladimir Putin announced that a coronavirus vaccine made by the Gamaleya Institute of Epidemiology and Microbiology in Moscow has been approved for use ;1293339163152928769;@55KRC
11/08/2020 19:10;Trump says he trusts Russians and Putin more than your government That is so much the talk of a traitor and unpatriotic ;1293339160632320002;@indepdthinker
11/08/2020 19:10;You won t have any feasible functional New World Order neither stable international cooperative future with Trump or Biden Xi Putin Netanyahu et cetera AU republic given current Russian gov infiltration CCP gathering influence over Police amp Military Former democracy drifts;1293339152637784064;@sw7739
11/08/2020 19:10; BeTramp She s putin s stooge in the WH RT HershAlan Speaking of Phony Kamala here is a picture of Phony Melania before and after vanity surgery Be best ;1293339149248823296;@ecorse1
11/08/2020 19:10;Trump Lashes Out at U S Officials Disputes Claim He Trusts Putin Over U S Intelligence ;1293339134061314048;@WatkinsDolf
11/08/2020 19:10;Tulsi Gabbard s certainly attractive and talks up a mean storm Same w that other Putin ite fringe female political personality whose name I don t recall Green Party Anyway what they have in common speaks to the likelihood they ve attracted covert Capital interest attention;1293339112473321472;@GuitarSunCat
11/08/2020 19:10;And still STILL Trump has an absurd amount of donors He may have been great for billionaires but who else benefits because of him Putin excluded RT EdMarkey million people have filed for unemployment during this crisis It s clear we must untie health care from employment We need Medicare for All and we need it now MASen;1293339081913630720;@UsesBadWords
11/08/2020 19:10;Trump you re ignorant to be surprised JoeBiden picked KamalaHarris Let the lies begin What a coward trump and WhiteHouse letting Putin kill our soldiers Kamala Harris is a TRUE patriot unlike the corrupt senatemajldr GOPLeader RepDougCollins SenateGOP betraying U S;1293339041312567299;@1world1goal
11/08/2020 19:10; Alert This is what Putin has begun to spin Let s Shut it down It s RUSSIAN INTERFERENCE version NOT TRUE TheDemCoalition TheDemocrats HouseDemocrats DNC SenDuckworth funder joncoopertweets thomaskaine Strandjunker JoeBiden KamalaHarris RT AllMattNYT NEW Reports of protesters burning stacks of bibles in Portland drew condemnations from conservatives It now appears to have been wildly exaggerated and the first viral hit in Russia s campaign to interfere in the elex AllMattNYT julianbarnes;1293339037839876097;@PatsLadi99
11/08/2020 19:10;Trump is wrong for America He s Putin s boy Trump says he wants to invite Putin to the next G meeting Business Insider;1293339018101497857;@BooksForArt237
11/08/2020 18:20;Putin ;1293326542995562496;@palpinnn
11/08/2020 18:20;Trumps marvellous health care plan Executive order to protect something already in Obamacare Next he will be importing Putin s vaccine Doesn t have a single idea of his own ;1293326516508667906;@msimonetta2
11/08/2020 18:20;I ve only ever heard trump say nice things about Putin Kim Jong Un Ivanka s body His insults are cheap and meaningless I m not bothered by the garbage that he spews I m aggravated and insulted that I m forced to witness his verbal diarrhea at all ;1293326510816931842;@aprilguev
11/08/2020 18:20;Democrats in August Haha suck it Bernie Bro he s never going to be president Democrats in November THIS IS ALL YOUR FAULT PUTIN PUPPETS NOW WE HAVE A CHEETO FOR MORE YEARS IF YOU GIANT BABIES WOULD JUST ACT LIKE ADULTS FOR ONCE IN YOUR MISERABLE BASEMENT DWELLING LIVES W;1293326500033253377;@tadpr0le
11/08/2020 18:20;Nothing has really changed since yesterday We still have to win in November and get to January th without Trump and Putin s republicans burning down the country So why do I suddenly feel more optimistic BidenHarris ;1293326475001765889;@grim_pet
11/08/2020 18:20;I can t believe Putin got Joe Biden to pick Kamala Harris ;1293326448393166850;@LibertyDoggo
11/08/2020 18:20; Trump RealDonaldTrump GeorgeWashington George Washington would have had Trump Shot as a Traitor to the USA the only way Trump would ever beat George Washington is if he had Putin fight that battle for him Trump would not defeat the legged man in an ass kicking contest;1293326447189295105;@KingMeren
11/08/2020 18:20;Imagine the look she ll give Putin RT LauraChapin I think of Kamala Harris representing our country at the G or the G and I get all swoony ;1293326420320456705;@VickiCowart
11/08/2020 18:20; FakeNews The Girl Receiving COVID Vaccine in This Viral Video is Not Vladimir Putin Putin s Daughter via indiacom COVID Pandemic COVID vaccine;1293326352163241985;@orthodoxconnect
11/08/2020 18:19; BidenHarris OUR WORK OUR OUR VOTE LANDSLIDE And putin trump and the gop can do nothing to stop it WorkGiveVoteBlue Resist;1293326305908449281;@indictmentduck
11/08/2020 18:19;WHEN TRUMP LOSES PUTIN IS GOING TO TRY OUT THE VIRUS CURE ON TRUMP FIRST BUT WHY DOES THE NEEDLE GLOW IN THE DARK O NO;1293326296966213641;@TRUTH77739033
