Date;Tweet Text;Tweet ID;Screen Name
12/08/2020 12:05; To be first to be to do to have to be remembered is how I will remember this pandemic there was a first it was WuhanCoronavirus now the race is on for this needed vaccine will we be made to take it to be fined jailed if we don t want it;1293594497062969345;@dwayneolds67
12/08/2020 12:05;Well isn t it very interesting that Trump has said a few times now that covid will magically disappear and that there would be a vaccine just in time for the elections Trump who constantly chats with his master Putin on the phone realDonaldTrump;1293594462946394112;@MacCheeseShow
12/08/2020 12:05;Wow tedcruz they are using you like a two bit hooker I am coming to understand that Cubans may be an evil branch of Putin Trump Jr Lying Ted Cruz shared Russian misinformation about Black Lives Matter protesters burning Bibles via businessinsider;1293594421448134658;@GOPKlanSucks1
12/08/2020 12:05;Putin owns RonJohnsonWI RT SafetyPinDaily GOP Sen Ron Johnson expresses hope that pandemic stimulus talks fail It s very good news Via Salon;1293594387809673216;@dufus
12/08/2020 12:05;Lol bro I keep saying this Vladimir Putin is out for world domination he got America out the way years ago;1293594364690739200;@BambinoYbm
12/08/2020 12:04;This could happen here if we don t get rid of Trump Putin Barr RT maddow BBC Security forces now shooting at protesters with live rounds in Belarus;1293594339789148162;@drdoodlie1994
12/08/2020 12:04;Putin let me show u how Russians handle shit RT maddow BBC Security forces now shooting at protesters with live rounds in Belarus;1293594339185176579;@tilbert
12/08/2020 12:04;Putin is asking to Trump if you are willing to come back as Usa president then you must obey my orders;1293594336102416384;@Ahmed09348773
12/08/2020 12:04;Russia developed corona vaccine Meanwhile Putin to Modi;1293594253235384320;@Bold_balak
12/08/2020 12:04;When the treasonous GOP start bailing on putin s bitch none of them except Romney get a pass CriminalGOP trumpcrimefamily;1293594220633026561;@CristopherOcean
12/08/2020 12:03;My WORST fear is that when Americans vote Putin will change the number electronically That s why we need to drop off our absentee ballot at the polling place and volunteer to count them BidenHarris ;1293594064588341248;@shari_tweet
12/08/2020 12:03;Low income people are not bad people Look to the Trump Administration to find the people you don t want as your neighbor Those are the people who plan to steal your Social Security Medicare and close your Post Office Those are the people who will have a party for Putin RT ChristyforCA This suburban housewife wants you to understand this is racism but I think you know that ;1293594024402591744;@wenwar69
12/08/2020 12:03;The GOP needs to shut trump s voter suppression attempts down Very very bad things will happen in this country if they try to steal this election Even Vladimir Putin can t save them this time They need to wait for another day to try and deceive and rob U S again ;1293593981415301120;@SpencerMagne
12/08/2020 12:03;Person of the Month Vladimir Putin Deadline for the vote September About Vladimir Putin Vladimir Vladimirovich Putin is a Russian politician and a former officer of the KGB who has served as President of Russia since previously holding ;1293593853119741952;@ofnfme
12/08/2020 12:03;Person of the Month Vladimir Putin Deadline for the vote September About Vladimir Putin Vladimir Vladimirovich Putin is a Russian politician and a former officer of the KGB who has served as President of Russia since previously holding ;1293593852851306496;@toonsmag
12/08/2020 12:03;Trump and Republicans don t know how to govern They serve Putin Biden Harris administration will govern and focus on the needs of everyone BidenHarris ;1293593844445876226;@DemNevada
12/08/2020 12:02;That s dirty old Joe doesn t get I hope Putin is ramping up RT politico Only percent of African American voters support Kanye West according to a new POLITICO Morning Consult poll;1293593813978619904;@bountytx
12/08/2020 11:21;I find myself explaining more often that I don t care if you re Republican or Democrat I m after Putin And if you are somehow associated with him You are on my radar;1293583275076784131;@scully_sullivan
12/08/2020 11:20;Everybody still skeptical abt Russian vaccn Russia Covid vaccine World leaders health officials have mixed response ;1293583218910695424;@SajiKG3
12/08/2020 11:20;Waiting for the Kanye West is working for Putin takes ;1293583184601456646;@WamsuttaLives
12/08/2020 11:20;Arizona s McSally makes an unfortunate case for a GOP led Senate via msnbcSee this as a DEMOCRATIC BONUS Figure the orange Putin won t get too many requests from those Republicans running McConnell s job is on the line ;1293583079865552896;@indianagranny70
12/08/2020 11:20;Vladimir Putin announced on August that the country s health regulator had become the world s first to approve a coronavirus vaccine for widespread use ;1293583037112946690;@NatureNews
12/08/2020 11:19;Jeremy Jacobs is Putin to Bettman s Trump;1293582991625719810;@JaredOfLondon
12/08/2020 11:19;The first vaccine in Russia was given to Putin s daughter In this regard the first vaccine in India will be given to Patra or Arnab sambitswaraj republic sambitpatra Arnab;1293582961443344384;@idpatankar
12/08/2020 11:19;so Putin and Russia have a vaccine for Covid I ve done drugs in random bathrooms with people I don t know I m ready ;1293582957379088384;@Felixx1990
12/08/2020 11:19;Isn t it kind of suspect that the trump administration agrees to get virus vaccine right after Russia says they have one We don t want a freaking vaccine from your freaking pal Putin Keep that shit out of the USA You may trust that SOB but we don t U traitor ;1293582923271032835;@ThomasHohn6
12/08/2020 11:19;Deli putin putin crazy putin bilimkurulu Korona Covid ;1293582919118839815;@TheBestAkrep
12/08/2020 11:19;Major US diplomatic push to counter Russia may be in jeopardy amid Belarus unrest of course it is because Trump LOVES Putin ;1293582916279304194;@minxiv7
12/08/2020 11:19;Listen to this sad afraid small man And the Republicans wonder why the midterms vanquished them from the House the polls favor Dems and the overall energy in this country right now is absolutely away from Trump and Barr and McConnell and Putin getting four more damn years RT MollyJongFast This is some fucked up shit right here ;1293582897631440896;@NancyNanjohnst
12/08/2020 11:19;I have confidence in Putin;1293582881135132674;@HarryWickham97
12/08/2020 11:19; Russia s Pres n Donald handler Putin claims have a vaccine coronavirus n he has given it his daughter When I saw the story I didn t think about the virus or vaccine my first thought was Somebody gave this psychotic muthaphkr some p ssy Was it forced in my Pryor voice;1293582875887992832;@jschln1
12/08/2020 11:19;All Democrats in the House and Senate should social distance on the steps of the capital and call out Putin and all Republicans who won t confront foreign influence in our elections You have to draw the media s attention and make a stand Shame the Republicans in public RT RepSwalwell It s long past time for Donald Trump to confront Vladimir Putin and tell him that our elections belong to us and us alone ;1293582875087036417;@MichaelTerran
12/08/2020 11:19;hey Amerifats feeling disinfranchised don t know who to vote for Write in Vladimir Putin in November writeinPutin douchecc AnatomicallyOK BigEvilJones Chuckie ar la AkuraElvas Irusk ;1293582801598644225;@PK_Tech_Vermin
12/08/2020 11:19;Trump is systematically erasing everything put in place by past admins The Open Skies Treaty the EPA Clean Air etc all at the request of his master Putin Putin s agenda is to be THE world power and he s getting his way Trump is destroying us ;1293582798813634562;@sally_beaver
12/08/2020 11:19;Maybe it s just me and maybe it was lost in the KamalaHarris selection but did realDonaldTrump ever release his healthcare plan Or did he ever confront Putin about bounties on our soldiers ;1293582787732070401;@DHHS_Podfather
12/08/2020 11:19;The trump putin led Republican party of disinformation doesn t care if your children live or die we must stop being one expendable nation under trump keepOurChildrenSafe keepschoolsclosed RT DrEricDing EGREGIOUS CHILD ENDANGERMENT Florida GovRonDeSantis just overruled schools that wanted virtual and instead FORCED the schools to reopen at gunpoint threatening to cut their funding if they didn t comply says school superintendent Despicable dangerous move RonDeSantisFL ;1293582770313232390;@MFaustian
12/08/2020 11:18;Trump ads on Facebook paid for in Russian Rubles Putin s interference in our election alive and well thanks to Zuckerberg ;1293582766106279937;@ARobhere13
12/08/2020 11:18;RUSSIA and Every Other Country STAY OUT Of Our Election We Are Not Some BANNANA Republic That You Can Manipulate By Violence Even Though Your Trying Money Or Your Sinister Crap We Could Work With RUSSIA But PUTIN MUST GO ;1293582718165331969;@bobcarr58684439
12/08/2020 11:18;William McGivney PhD Is not this world getting crazier every day As we eagerly await a coronavirus vaccine from our great Universities e g Oxford and the world s great biopharma companies who but Vladmir Putin announces to all Cool your Jets I have this one my ;1293582701618819072;@OBRtweets
12/08/2020 11:18;After blocking any vote for last days on House voted Sent to Senate a COVID Relief Bill amp Rent Protections amp Unemployment BUT MoscowMitch got a phone call from Putin amp Delayed Votes until America BURNED now MoscowMitchMcConnell is a Traitor and should be Arrested RT CraigCaplan McConnell begins Senate floor remarks on status of COVID relief talks which have stalled since Friday It s been clear for some weeks that the Speaker of the House and the Senate Democratic Leader are treating this crisis like an ordinary political game ;1293582696241758209;@406Llama
12/08/2020 11:18;Putin s SputnikV vaccine is just in time for Donald s desperate attempt to stay in office PutinTrump PutinsGOP;1293582679326121984;@hyperbranch
12/08/2020 11:18;Putin was water skiing as Russian sailors drowned He denied for days accused the relatives of lying refused assistance The first of his major failures but probably most notable for his lack of empathy utter contempt for human life RT AtomicAnalyst OTD in during a large Russian naval exercise in the Barents Sea north of Murmansk the Oscar class nuclear submarine Kursk sank with crew aboard An official report blamed a powerful explosion triggered by leaking hydrogen peroxide fuel in an old practice torpedo ;1293582651425730566;@dzhoseff
12/08/2020 11:18;Putin will have plenty of Guinea Pigs MAGAS will be more than willing to take the Putin Vaccine ;1293582606580305920;@OpsterOpp
12/08/2020 11:18;ATTENTION Instead of Condeming PUTIN for Paying Taliban to Kill America Soldiers TRUMP Go s Off on a Rant about Comedian Bill Maher BOY oh Boy Trump s Dementia is REALLY Effecting his Brain It s Time to put Trump in a Nursing Homes Vote JOE BidenHarris RT mmpadellan This bit from Bill Maher a while back was funny Tragic but still funny ;1293582576997859329;@Joni_Looking
12/08/2020 11:17;The Amer people dont like Presidents realDonaldTrump who are more friendly with Russias Putin than his own country military U S and HIS OWN PEOPLE ;1293582492289695746;@HelenaofTroy60
12/08/2020 11:17;Look at the irony India Today has been trying to build image for aloo sona vala from decades but they will analyze whether Putin is trying to build image RT sardesairajdeep pm News Unlocked decoding the Russian vaccine vaccine nationalism scoring over medical research is Putin simply looking at image building in corona times A view from experts in India and Russia IndiaToday News without the noise ;1293582436312342528;@UnitedHKJ
12/08/2020 11:17;Kissinger statecraft is a much more likely explanation of Trump s coziness with Putin Shows how infantalizing the Trump Administration can give cover to their actual political strategies RT Mark C Casper Mont Jiang;1293582429681324033;@Mont_Jiang
12/08/2020 11:17;Vladimir Putin Claims Russia Has Approved World s First Covid Vaccine VladimirPutin Russia Covid Vaccine;1293582402598707205;@National_Digest
12/08/2020 11:17;Idiot Flynn is a PUTIN loving traitor The Portland folks are angry and disappointed and sick and tired Americans ;1293582345170124800;@jrflamingo
12/08/2020 11:16;Trump has never put America first His allegiance is with Putin and his own self interest Presidents have always put their businesses into a blind trust which Trump has pretended to do RT OkraskaRick Let it rip ;1293582207806840833;@walton_vikki
12/08/2020 11:16;Trump idolizes Putin no question He s Putin Light or WANTS to be RT RepSwalwell It s long past time for Donald Trump to confront Vladimir Putin and tell him that our elections belong to us and us alone ;1293582187032383500;@lesliesusan27
12/08/2020 11:16;Putin said they have a COVID vaccine it has been given to his daughter he didn t say he had taken it too I think if true the Russian ppl will be guinea pigs for it s efficacy Personally I think he was just trying to test how much this would move the stock market ;1293582181089136641;@eclairevoyant
12/08/2020 11:16;Putin named the Russian Covid vaccine Sputnik V He may be a murderous tyrant but he s definitely got a sense of humor ;1293582099493027842;@neomort
12/08/2020 11:16;Trump v Putin A Vaccine Manhood Contest via YahooNews;1293582068044181512;@goshdarngeewhiz
12/08/2020 11:16;Russia registers Covid vax Putin s daughter in test group;1293582048959979520;@themunsifdaily
12/08/2020 11:15;THING IS He has NO CREDIBILITY WHATSOEVER and Biden Harris have given us HOPE that TOGETHER WE CAN FIX THIS DISASTER the Orange Putin and his incompetent choices will be GONE We can MAKE IT RealDonaldTrump RT CapehartJ We re getting Trump in Full Divorced Guy Mode pulling out every last vindictive more in his arsenal ;1293582004332761089;@indianagranny70
12/08/2020 11:15;President Putin s and president Macron s phone call today RT rusembleb ;1293581933457428486;@colderrthannice
12/08/2020 11:15;Putin s yesterday s remarks on the vaccine have consistency and validity within and are accurate as i see it Since he as a former intel asset knowing a diplomatic discourse takes its pith from reasonability and timing knows how to create impact and moral panic on target society ;1293581914717249536;@xxvii_27_
12/08/2020 11:15; BidenHarris Is anyone as happy as I am that we now have a team and they are going to take names and kick ass Please address this whole Trump Putin pinky shake wink wink nod nod business FIRST AND FOREMOST It s something dark and dreary ;1293581910980079618;@MeetsSarah
12/08/2020 11:15;Just let it sink Macron in his conversation with Putin expressed his serious concern wrt t situation in Belorussia violence against citizens Macron The very Macron who for a year has been violenty dispersing the Yellow vests He s just the right person to condemn violence RT Kornilov ;1293581895951945732;@Mainrushun
12/08/2020 11:15;THE FEVER BUILDS Gunman outside the White House The mood is getting ugly Simpletons are being told times a day that Trump is corrupt his administration unconstitutional and illegal That he s a Nazi and killing little brown babies and taking his orders from Putin ;1293581858014400514;@JosephamillerII
12/08/2020 11:15;You ever notice how pence putin look alike LOL ;1293581847344156681;@DownWithTrump51
12/08/2020 11:15;Liz Cheney calls Kamala Harris a radical says her voting record is to the left of Bernie Sanders FoxNews but Trump is both far left and far right kissing the behind of his idol the KGB Czar Putin a confirmed commie who Now follows the nazi ideology ;1293581809687490561;@JSemkiv
12/08/2020 11:15; HTBX Putin must ve never seen Rocky we going up after these follow up reports ;1293581793539620866;@RobinHoodlums
12/08/2020 11:15;Whaaaaatttts upppp Ohh just sitting in the garden with my Bud ;1293581782638645248;@Putin_the_nuke
12/08/2020 11:15;Former FDA Associate Commissioner Peter Pitts says there are many questions behind the announcement by Vladimir Putin Sounds like Russia ;1293581771884204038;@StenHubinette
12/08/2020 11:14;When President Putin took Mangta hai to aaja RUSSIA Damn seriously for the vaccine;1293581745913135109;@GazabOfficial
12/08/2020 11:14;Anyone who watched Chernobyl would be crazy to believe the Russian Government via WSJ;1293581736392060928;@MMCOWRD
12/08/2020 11:14;Obviously Trump lmao unless Putin comes and nvm RT Breaking TICKET SET Who Wins The Presidential Election RETWEET ;1293581721355595776;@Specs_52
12/08/2020 11:14;You are a total liar None of that is true Have you been bribed by Putin like all your colleagues RT TomCottonAR Kamala Harris supports Medicare for All she has implied that Joe Biden is racist and she laughed at the idea that the Constitution would stop her from confiscating guns Her presidential campaign was a mismanaged catastrophe that ended before any votes were cast ;1293581688593842177;@MarleneMalik2
12/08/2020 11:14;Russia is the first country to approve covid vaccine says Putin AMCostaRica CostaRica;1293581660508885002;@AMCostaRicaNews
12/08/2020 11:13;I don t agree with her policies but she served in our military honorably This denigration has to stop Also Trump and the GOP have been MUCH harder on Putin than the previous admin and it was Hilary and the Democrats that used Kremlin misinfo to try and derail the presidency RT ChiVoltage ChrisLoesch TulsiGabbard KamalaHarris How can we forget Tulsi Like RealDonaldTrump and the GOP she works for Putin ;1293581472516001793;@ChrisLoesch
12/08/2020 11:13;A vote for Trump is a vote for and by Putin ;1293581429524385793;@RSKazimer
12/08/2020 11:13;What s NASTY conman fat ass realDonaldTrump up to today Have you gotten around to dealing with Putin killing our troops or are you too busy being a racist asshole How about a plan to deal with the trumpVirus What about relief for the millions of unemployed DoNothingConman;1293581416249384961;@ShellySin1
12/08/2020 11:13;Don t forget tax evasion adultery rape grabbing women s various parts colluding with Putin and killing over Americans due to incompetence to name but a few Devil is in the details Details that will send Trump and VP Putz to HELL Hallelujah RT BernieSanders Unlike the very stable genius I m not a religious scholar But somewhere I read that pathological lying and providing tax breaks for the rich while ignoring the pain of the hungry the homeless and the sick is not exactly following the golden rule ;1293581415452250112;@Rebecca41356515
12/08/2020 11:13;There should be a jimandsamshow after show called the Tefftification of the USSR where travistefft can vent all if his pinko commie narratives He wants Putin to come up with the cure himself notsam JimNorton He needs the influence of real patriots like ChipChipperson;1293581313694412801;@GoodSteward17
12/08/2020 11:13;Putin to Indian Govt ;1293581289614741504;@frrankoceann
12/08/2020 11:13;Trumps Virus is destroying our nation Still no plan but I guess he s letting putin come in and save the day with an unproven vaccine RT DeaconBlues Trump is mad that the college football season has been cancelled This is on him All sports and the country would be back if he just had a plan back in February or March Even April or May would have been sufficient Now Biden Harris they have a plan ;1293581271432441859;@MaisonDeUnicorn
12/08/2020 11:12; pm News Unlocked decoding the Russian vaccine vaccine nationalism scoring over medical research is Putin simply looking at image building in corona times A view from experts in India and Russia IndiaToday News without the noise ;1293581256454635520;@sardesairajdeep
12/08/2020 11:12;Take heed Folks We can throw a bomb into trump s Putin s election cheating apply for an absentee ballot put it in a drop off box or hand deliver it to your county courthouse election board wherever you can safely bring your precious vote Guard it like you would a child RT Junzie PunditCatGeorge NPRinskeep NoelKing NPR My husband works in a large distribution center in south Jersey He s yrs old This mf er is killing him Shit is piling up all over Truck routes cut No temps No OT Get your ballots early and take them to drop off boxes Bypass the USPS ;1293581135721660416;@lindacaseauthor
12/08/2020 11:12;There would never be a better example of voting against one s self interest than if one black person voted for Kanye instead of Joe FakaktaSouth donald j putin RT maggieNYT NEW Kanye West met with Jared Kushner last weekend in CO as West continues with an effort he has indicated is aimed to harm Biden ;1293581092931477506;@Robertamnesia
12/08/2020 11:12;Look for Barr to bring criminal charges against Trump s political rivals It won t work but Trump is desperate and Putin is advising him They are waiting until we are close to Election Day so that the bogus charges can t be addressed until after the election RT robreiner Starting to hear Donald Trump s Racist Sexist Death Rattle ;1293581083720720392;@CollinsDionte
12/08/2020 11:12;Lindsey is not smart and has fully bought in to Putin s agenda Elect harrisonjaime South Carolina RT LindseyGrahamSC Senator KamalaHarris will be a formidable opponent She is smart aggressive and has fully bought in to the Democratic Party s very liberal agenda Trump ;1293581074086338566;@geokaren
12/08/2020 11:12;Russia s coronavirus vaccine Is Putin taking a reckless step via dwnews Russia russiavaccine vaccine vaccines ethics humantrials Pharmaceutical research medtech publicmedia ViewFromGermany;1293581013835186178;@vubblePOP
12/08/2020 11:12;Donald J Trump realDonaldTrump Mike Pence Mike Pence is a puppet to Russia s President Putin and to the Radical Right Republicans CorruptTrump PuppetTrump CorruptPence PuppetPence MadamVicePresident BidenHarris ;1293581011918434305;@KeylanHarris
12/08/2020 11:12;I think it s a dumb Dem take to suggest Trump has been compromised by Putin I think the more likely scenario is that they have an actual coherent geopolitical strategy of trying to win Russia away from China engendering a new Sino Russo schism Dems are like pee pee tape RT realDonaldTrump John Bolton one of the dumbest people I ve met in government and sadly I ve met plenty states often that I respected and even trusted Vladimir Putin of Russia more than those in our Intelligence Agencies While of course that is not true if the first people you met from ;1293581007078260737;@Mont_Jiang
12/08/2020 11:11;I won t use ANY vaccine endorsed by either Trump nor Putin because they will both place politics before safety ;1293580989743001600;@TheWoofus
12/08/2020 11:11;I think Russian vaccine should be given to Trump first Putin is his friend not mine Will not take any vaccine from Putin It s fake science being produced ;1293580946495680513;@Space48361074
12/08/2020 11:11;I don t like giving ppl the satisfaction of hearing me say anything bad about Putin But there is no way in Hell that my dad would allow me to be injected w that slop If he believed it worked he d have himself injected before allowing it to happen to me my brothers RT cnni What we know and don t know about Russia s Sputnik V vaccine President Vladimir Putin says his own daughter has already received it but testing is yet to be completed and experts are skeptical about how quickly the vaccine has been registered ;1293580914975440899;@CaldariWaifu
12/08/2020 11:11; Putin better get that vaccine here ASAP re batla go ya Comrades next year hlem ;1293580865814102022;@MphoMfolo
12/08/2020 11:11;Vladimir Putin s coronavirus vaccine was approved after tests on people ;1293580848558637056;@Sm411R
12/08/2020 11:10;Vladimir Putin is a shitty human and this brief story tells of his recent adventures He yelled NO COLLUSION into the vortex then he tried to build a wall then he went home to play golf check twitter and sob alone on the toilet ;1293580740714729475;@bot_london
12/08/2020 11:10;Madman conman lying corruptTrump PUTIN PUPPET the onlywomen he like r the ones he can control the weak like the gop women they r so weak they will full anything that lying conmanDONsay Dem women r strong women no man will continue them crazyTrump u have no MORAL u have no DECENCY;1293580722402406400;@idaw468_ida
12/08/2020 11:10;Fauci Azar cast doubt on Putin s coronavirus vaccine claim CBS News;1293580721051836417;@YouGottaVote
12/08/2020 11:10;Anyone know if Putin is crapping his pants over Kamala now ;1293580681553960960;@Dbltapp69
12/08/2020 11:10;Putin no me ilusiones;1293580670653083648;@agusaleok
12/08/2020 11:10;Putin and Bill Gates Drop BOMBSHELL About COVID You ll Be Floored By Wh via YouTube;1293580580336988163;@StormStryder1
12/08/2020 11:10; This is no longer a debate Florida sheriff bans deputies visitors from wearing masks President trump redesigns our police force to be soldiers attacking Americans Part of the Putin trump Moscow Mitch plan Kill as many for Putin as possible;1293580547864662017;@Deborah75639043
12/08/2020 11:10; Russia has a COVID vaccine and President Putin says it s been through all the required tests No it hasn t says everyone else If this vaccine really works scoring political points off it will devalue the achievement ;1293580518416617472;@oxfordanalytica
12/08/2020 11:09;AND PUTIN BEEN HAD YOUR FAMILY IN HIS POCKETS FOR YEARS GO TRY HIS MEDS STUPID SHE WILL EAT PENCE UP IN DEBATES LOL RT DonaldJTrumpJr The radical left has officially captured Joe Biden ;1293580480437202950;@costello59
12/08/2020 11:09;Rump Serves Putin Not America ;1293580411055026176;@rbisrb
12/08/2020 11:09;World first against coronavirus vaccine approves by Russia Putin;1293580377831833605;@DevarintiSiva
