Date;Tweet Text;Tweet ID;Screen Name
12/08/2020 17:20;Oops and the out of this people are Putin s daughters Didn t he say that they were already vaccinated ;1293673804787593216;@geometryfan
12/08/2020 17:20;Putin tRump RT smc GOPChairwoman GOP BountyGateAintGoingAway;1293673783165882374;@kz1300a4_lee
12/08/2020 17:20;HaHaHaHa Vladimir Putin You GO Boy KremlinRussia E mod russia MedvedevRussiaE when is that vaccine going to be available here WHO DrTedros JustinTrudeau realDonaldTrump CDCgov RT rianru ;1293673750408433667;@PrincessBibiRF_
12/08/2020 17:20;ohhhhhhhh putin RT Samsinho Notre voiture a brul mais al Hamdoulilah on a pu prendre une photo;1293673745148764160;@assouu___
12/08/2020 17:20;Not today Putin ;1293673669236002819;@AnthonyAggie17
12/08/2020 17:19;Putin s vaccine must be the reason Donny has been so sure there would be one by fall and why US medical experts were like Huh RT stonecold Putin thinks he can save the election for BidenHarris ;1293673516512899072;@CoastalCndn
12/08/2020 17:19;Most embarrassing use of The Oval Office EVER Well except when he had Russian Oligarchs in there requesting privacy to get orders from Putin ;1293673491737313281;@surge4earth
12/08/2020 17:19;For realDonaldTrump Russia Putin Bounties Troops Silent BountyGateAintGoingAway RT votevets days since reports of Russian bounties on our troops days where Trump has proven his loyalty to Putin over American lives days until the election TraitorTrump vote;1293673475962548234;@lynsnyds1
12/08/2020 17:19;Vladimir Putin Donald Trump vs Vladimir Putin A vaccine manhood contest The Economic Times;1293673431657902080;@Midge150
12/08/2020 17:19;Putin is reportedly looking to expand Russia s presence in Africa with new bases in Central African Republic Egypt Eritrea Madagascar Mozambique and Sudan;1293673417690898432;@the_sailor_dog
12/08/2020 17:19;CNN and MSNBC keep it up Traitor trump and Putin s GOP should never have air time to spew their kremlin propaganda RT PalmerReport Trump is holding a press conference right now CNN and MSNBC aren t bothering to air it ;1293673371566317570;@debjanise
12/08/2020 17:18;Putin C RT jaredlacaran putin announces covid vaccine duterte putin my friend xi jinping sinuntok ang pader ;1293673356525355009;@EmmanGuevara
12/08/2020 17:18;Kamala should bring Pence a gift Like Putin gave Trump a soccer ball She should bring a notarized framed copy of her birth certificate Just in case that brother crap from his boss spews out from the resolute desk before Nov SenBooker ChrisCoonsforDE Liked that Bucket RT realmotohussy Can t wait I ll bring the popcorn BidenHarris Harris VoteBidenHarris ;1293673347042222081;@DUNROVIN15
12/08/2020 17:18; Putin is well aware of the essential implications of successful COVID vaccine development So it s very quick to develop BeckerFriedman realDonaldTrump KremlinRussia E BillGates AbeShinzo pfizer Bank of Japan e BoE Research BIS org NIH MIT GlobalNTT NTTPR RT CNBC Russia says vaccine could be in use by November and has been developed over six years;1293673282428784641;@high_level_rd
12/08/2020 17:18;More Deficit realDonaldTrump is just Bankrupting the USA Is he hoping Putin can waltz in and take over after the bankruptcy RT ddale Trump promises to completely forgive deferred payroll taxes if re elected but also promises to fully protect Social Security by taking money from the general fund ;1293673247633035267;@jaam91
12/08/2020 17:18;Of all state employees the police law enforcement agencies and the like receive the highest salaries apartments from the state and other bonuses WHY Putin s strategy So they will never trample on him russia;1293673179504877570;@EvgePinsel
12/08/2020 17:18;Tootin Putin I ain t ever heard of him before ;1293673162845179922;@jamiedlux
12/08/2020 17:18;Russia with its negligible pharmaceutical industry billion export vs billion import will mass produce a vaccine that has been tested only on people just to save Putin s own old ass I m not an anti vaxxer but I m sure AF anti Putin s Chernobylic murder drug ;1293673159124643840;@DrHueyLi
12/08/2020 17:18;The Russian Right moves to support Putin senatemajldr LindseyGrahamSC SenRonJohnson SenCoryGardner GOP Jim Jordan Liz Cheney RT ImpeachmentHour So Trump says the US will buy doses of an untested unproven Russian Covid vaccine Anybody see this coming ;1293673135817072642;@DefeatColoRep
12/08/2020 17:17;Probably they made a deal with Putin that they d have Pompeo say this and then it would drive the Belarussians to Big Russia RT nypost Secretary of State Mike Pompeo vows to deliver freedom in Belarus;1293673045622652928;@Bollocksworth
12/08/2020 17:17;Putin US Presidents Are Not Very Powerful Men in Dark Suits Rule Washington via YouTube;1293672866379177988;@pohamila
12/08/2020 17:17;So who s buying Putin fake vaccine He kills people RT maddow BBC Security forces now shooting at protesters with live rounds in Belarus;1293672864416137219;@VeroArtistBlue
12/08/2020 17:16;Trump will try to handle her Putin style Everyone stay safe RT HoarseWisperer Kamala Harris laying out a scorching prosecution of Trump s mishandling of the COVID crisis Trump cannot handle direct confrontation by strong women He is in for a long three months ;1293672818962464775;@Solarman1955
12/08/2020 17:16;India also has vaccine against covid but like Putin Modi doesn t have a daughter for the fast trial ;1293672770786799616;@sanjayp78413705
12/08/2020 17:16;As is so often the case Putin can t lose RT akoz Alexander Koc one of the most trusted Kremlin propagandists all day on Russia convincingly speaks of mass peaceful protests and extremely harshly denounces the atrocities of the OMON The Kremlin is clearly playing on two boards and weighing two options for the Anschluss ;1293672750326910978;@Sam_Schulman
12/08/2020 17:16;The GOP ShadowTicket Kanye and Putin ;1293672749399932929;@mimilu
12/08/2020 17:16;The entire media regime and the pharmaceutical criminal cartel that until yesterday praised the virtues of vaccines today express doubts about Russia s vaccine Putin practically turned Pro vax fanatics into No vax ;1293672704340623367;@PaulDray
12/08/2020 17:16; The Russian Gamaleya institute that produced the first vaccine in the world against Covid is state owned It is not in the hands of Bill Gates With this move Putin put an end to the Covid terrorist operation in Russia It is extraordinary ;1293672677903867904;@PaulDray
12/08/2020 17:16;Is Putin involved in this too RT franakviacorka Weapons used by the military and KGB group Alpha injure and kill Natalya Lubnevskaya from Nasha Niva was wounded and is now in the hospital Another colleague from was lucky and the bullet passed by ;1293672621503127554;@Frass2u
12/08/2020 17:16;YOU ARE SO RIGHT NOW WE HAVE TO WORRY ABOUT THIS COVID VACCINE BUY TRUMP WANTS FROM PUTIN RT robreiner The battle lines have been drawn It s The Union vs The Confederacy Its Decency vs Cruelty It s Justice for All vs Justice for the Privileged It s the battle for The Soul of our Nation And Our Union will win again ;1293672616792915970;@boomer55u
12/08/2020 17:15;PUT IN HOPE Mrsoumen Russia russiavaccine putin vaccinoCovid Corona CoronavirusVaccine;1293672584194560000;@mrsoumen41996
12/08/2020 17:15; TrumpKillsUSPS This is the most corrupt criminal treasonous administration in our history Between gerrymandering closing polling places working with Russia nothing is off the table Putin has us against the ropes and he s working hard RT chipfranklin Using the hashtag TrumpKillsUSPS let me know in the comments how you think Trump will try and rig the election I ll start He s going to delay the ballots and say we don t have a winner and go to court for years TrumpKillsUSPS;1293672556642402310;@doodlebug4845
12/08/2020 17:15;Make this nightmare over in Nov Trump v Putin A Vaccine Manhood Contest via YahooNews;1293672537159802883;@FrankJa55485824
12/08/2020 17:15;Is she making a threat or does she know what putin trump plan Judge Loudmouth RT MeidasTouch CC SecretService;1293672531417866241;@FranSparks18
12/08/2020 17:15;If any candidate for President is actually afraid to debate his opponent as Biden appears to be then he should not even be considered for President How can he stand up to Putin or any other world leader if he can t even handle debates here at home RT WhiteHouse LIVE President realDonaldTrump holds a news conference;1293672455861657601;@swann2001
12/08/2020 17:15;What Trump is saying I like Russia better since he s in bed with Putin move there RT JoeNBC Donald Trump just said that Russia China and Iran run elections more effectively than Democratic governors How sick and how sad for Republicans that Trump keeps alleging voter fraud before an election Why doesn t he just hold up a sign that says I know I m going to lose ;1293672384214507520;@carrmarie70
12/08/2020 17:15;It s time to get Putin and his puppets out of the White House and Americans back in ;1293672361787523073;@AlvinTheHipMonk
12/08/2020 17:15;The GOP is rigging the election using Kanye and Putin They don t the post office they don t need the voting booth They just need Kanye and Putin ;1293672360512495617;@mimilu
12/08/2020 17:14;trump is a hateful stupid ignorant pedophile who is a pathological sociopathic liar and a loser who is owned by Putin and hates all Real Americans trump is a murderer of innocent people ;1293672326282829831;@Herbwells7
12/08/2020 17:14;tRump to Putin My people understand that if they kiss my ass I ll kiss theirs in return But they have to kiss my ass first But for a great leader like you I ll kiss your ass first and repeatedly and you don t even have to kiss mine back ;1293672299711934466;@ultimate1us
12/08/2020 17:14;Putin I challenge you here and now Inject me with your vaccine I will then decide if it is true Until then I say it s a farce just like the rest of your life wrinkler RussianVaccine;1293672266631393288;@raspootang
12/08/2020 17:14;This is a Putin driven country Pure evil Take a good look Americans trump obeys Putin RT anneapplebaum Happening in Europe right now;1293672256565055501;@itutoresl
12/08/2020 17:14;Vladimir Putin Russia Has Developed The World s First Treatment Shot COVID ;1293672205927227400;@WeAreChangeNYC
12/08/2020 17:13;And now Donald smiles and laughs When Vladimir Putin pays the Taliban to murder American soldiers Quite a king you picked to serve uber alles RT RepLeeZeldin With a straight face Biden just said President Trump has been coddling terrorists around the world After Biden advised AGAINST taking out Bin Laden now he s ignoring that it was Pres Trump who had Soleimani al Baghdadi killed the ISIS caliphate eliminated and far more ;1293672072615469056;@Tao23
12/08/2020 17:13;I m calling the Russians Frens Putin Forever;1293672058488885249;@stefanoshow
12/08/2020 17:13;True but hats off to Putin for first finding then marinating amp then helping trumpster his idiot agent to become the leader of the free world RT genuine ersatz Trump must the dumbest Russian asset the KGB has ever recruited This moron has blown his cover many times over ;1293672041321771010;@msohadi
12/08/2020 17:13;We tracked you to Moscow on the th of July for your meeting with Putin RT JohnCornyn GovTrak ranked Kamala Harris the most liberal Senator for ;1293671962137378816;@EddieFeldmann
12/08/2020 17:13;It so amazing you put a new head of USPS right before election Try to slow down mail There is no fraud in mail in voting You are the fraud along with your buddy Putin You will go down Jail cell is awaiting AmericasGreatestMistake RT WhiteHouse LIVE President realDonaldTrump holds a news conference;1293671938548592640;@BlomstromRobert
12/08/2020 17:12;Antarctica has oil Why haven t we invaded yet Trumps probably too busy having gay sex with Putin ;1293671837541392385;@ProjectLincolnn
12/08/2020 17:12;How soon before Trump touts Putin s vaccine VoteBidenHarris ;1293671831728271362;@baryo_j
12/08/2020 17:12; I seriously doubt that they ve done that Fauci Fauci Azar cast doubt on Putin s coronavirus vaccine claim via CBSNews;1293671791546621952;@iVoteAmerica
12/08/2020 17:12;Democrat neoliberal white liberal come back responses to criticism Bernie lost You re privileged Trump supporter MAGAt Are you a Republican Russian asset Are you working for Putin You don t care about others So you want Trump to win We don t need you ;1293671790464716801;@IamJWilliams95
12/08/2020 17:12;I wouldn t t drink a sealed bottle of fucking water that Putin or Trump sponsored RT ImpeachmentHour So Trump says the US will buy doses of an untested unproven Russian Covid vaccine Anybody see this coming ;1293671789994811392;@LALALandLeafFan
12/08/2020 17:12;Does trump appear even more desperate and terrified He knows he is gonna lose He is setting the stage for trying to say voter fraud Looks like Putin was stopped maddow ProjectLincoln MeidasTouch CREWcrew jaketapper JoyAnnReid SenateGOP senatemajldr MittRomney;1293671752933896193;@MichaelFrankie6
12/08/2020 17:12;I find it incredulous that our government is lining Putin s pockets this way Trump is absolutely a Russian asset RT ImpeachmentHour So Trump says the US will buy doses of an untested unproven Russian Covid vaccine Anybody see this coming ;1293671693928394752;@StarryGirl99654
12/08/2020 17:12;HA I wouldn t accept a S mores from Vladimir Putin ;1293671663880593411;@FabulousThomasJ
12/08/2020 17:12;He s missing out on some other rigged election that is shaking the world right now Probably hasn t got any instructions from Putin yet RT RadioFreeTom The president is referring to the coming election as the most rigged election in history the greatest fraud in history and the only thing worse is that his campaign was spied on by Obama The paranoid ramblings of a broken man ;1293671644347674627;@sankuperis
12/08/2020 17:11;Another day another press conference where DictatorTrump acts like a big man daddy like his BFF Putin PutinsPuppet TrumpCoup BidenHarris ;1293671572734193664;@autarchofTexas
12/08/2020 17:11;What you think Russia will be nice Putin don t think he will go for that no matter how much its been tightened tucked stitched She might be able to suck the chrome off a truck hitch But China and Russia North Korea might want more in an adversary RT Stonewall The left is already crying sexism in defense of Cabala Harris Why would you pick someone who you don t believe is strong enough to handle the world stage ;1293671421730869254;@WillsLyn
12/08/2020 17:11;Biden saved big bucks using payroll tax loophole via YahooFinance Russian republican fox interference Putin will NOT get a second term as president of the USA ;1293671405893156864;@AlEastmond
12/08/2020 17:11; GrifterTrump owes Putin lots of money US taxpayers are paying it back RT ImpeachmentHour So Trump says the US will buy doses of an untested unproven Russian Covid vaccine Anybody see this coming ;1293671366357647362;@Kemp4Democracy
12/08/2020 17:10;Dr Anthony Fauci told ABC News Deborah Roberts that he seriously doubts the Russian made COVID vaccine dubbed Sputnik V and touted by President Vladimir Putin has been proven safe and effective VoteOutGOP VoteOutSusanCollins VoteOutTrump ;1293671305984843777;@PinkSheepNews
12/08/2020 17:10; putin says RussianVaccine is safe just to make VP trump WhiteHouse freaking upset let s not go down that road RT wildwestleft ImpeachmentHour courageousgirl MONEY LAUNDERING VIA OUR TAX DOLLARS GOP GOPLEADER;1293671282513457152;@mooneye13_the
12/08/2020 17:10;I have heard that when Clinton or Blair entered a room you could feel the electricity when Putin walks in you can smell the fear when Williamson walks in people become narcoleptic RT mrjamesob In a crowded field sitting your A levels in Autumn is the stupidest idea The first thing I learned in today s phone in was that students stopped studying when the exams were cancelled in March It s obvious when you think about it But not obvious enough for Gavin Williamson ;1293671265404887041;@nigel_revell
12/08/2020 17:10;early s NATO basically saw Putin as an ally in their game to destroy and privatize the last remnants of Soviet institutions in Belarus my theory is they still do to an extent RT paulkleinfancam Unified NATO approach to more effectively put pressure on Russia Use Russian TV stations for psyops directed at the Belarusian viewership ;1293671254092926977;@LizardGirl0
12/08/2020 17:10; InsteadOfMasks we should make Vladimir Putin ruler of the world;1293671171498573824;@Brandon20105199
12/08/2020 17:10;Because it s Putin s puppet Trump occupying our White House VoteBlue RT McFaul Why is the West so silent ;1293671169762242562;@PeggyAbrahamson
12/08/2020 17:09;What an utterly corrupt Barr Flynn sold us out and everyone knows it Putin must be loving the decision emptywheel chipfranklin ProjectLincoln JRubinBlogger RT harrylitman OK sports fans based on yesterday s argument before the full DC court of appeals the court is going to rule against Michael Flynn and the DOJ but Flynn will still be sprung unjustly in fairly short order My latest oped for the latimes ;1293671088509992961;@TheScottLove
12/08/2020 17:09;TRUMP ALLOWS SNIPER RIFLE SILENCERS TO BE SOLD TO FOREIGN ARMS DEALERS READ PUTIN s GRU Inside the White House a Gun Industry Lobbyist Delivers for His Former Patrons;1293671074484441093;@carman17838926
12/08/2020 17:09;Good raise taxes on the rich bring back Obamacare but at free coverage bring back the economy stop the death of lives that the gop destroyed GOP Gang of Putin realDonaldTrump RepAdamSchiff SenCoryGardner SpeakerPelosi GOPLeader GOPSenate JoeBiden RT GOPChairwoman Biden and Harris want to raise your taxes eliminate your health plan and send your utility bills through the roof That s not for the people It s for the radical left ;1293671062543065093;@ssguffey
12/08/2020 17:09;PUTIN Is Shaking In His Boots Because He Knows If TRUMP Goes Down Hell Loose Favor With The People That Really Controls RUSSIA He Might Be Going For A One Way Fishing Trip ;1293671029131235329;@bobcarr58684439
12/08/2020 17:09;Um Hillary bought the fake dossier from Putin genius RT craig Boognish thehill The only people still talking about the dossier are idiot Trumpers who believe Putin over US Intelligence;1293670916166221827;@Boognish12
12/08/2020 17:08;Yep my Putin RT korol koshek RomanaVolny Putin is a Russian Saint and the Devils of the Nazi West gnash their teeth in Hell ;1293670753381109760;@RomanaVolny
12/08/2020 17:08;The Republican Presidential nominee Trump will be the most Russian Red Putin asset our country has ever seen RT VoteMarsha Kamala Harris will be the most liberal left wing nominee for Vice President our country has ever seen ;1293670648737337351;@Lemieux1150Jane
12/08/2020 17:08;Winning FakaktaSouth donald j putin MajorSnowflake Rddedhd RT carriemelago Schools in Memphis can stay open until coronavirus positivity rate hits Twenty Five Percent ;1293670613169647617;@Robertamnesia
12/08/2020 17:07;Trump alignment with Taiwan is dangerous and orchestrated by putin;1293670585298452486;@thetruthtoliar1
12/08/2020 17:07;Donnie can t call Kamala Nasty You already gave that name to Hillary Now if you call Hillary and ask her if she would share the name with Kamala Then we ll print the t shirts I m telling U you have to teach these Trumps everything Putin I thought you had this under control ;1293670566692618248;@mommacorner
12/08/2020 17:07;Liar IvankaTrump you moved to Washington DC to enrich yourself Everybody knows it If you can t say something without telling a lie don t say anything at all And anyway nobody wants your kind of help unless they are the mafia or Putin RT truthshallwhat We don t want your help or even asked for it IvankaTrump;1293670521159192576;@RadioFlyer1101
12/08/2020 17:07;Why hasn t Putin tried his new miracle drug Why isn t Putin sharing with his good buddy trump RT robreiner Trump s BFF announces a Covid vaccine Trump should honor him by taking the first dose then start working at a meat packing plant ;1293670492704890880;@Sheryl23373427
12/08/2020 17:07;Would it take it That s a hard FVCK NO How much do you want to bet that Trumps going to force it on the American people claiming that it s from Moderna or Novartis or somewhere I ll take a vaccine it it is vetted by Biden s people ;1293670385611726849;@Bizypawz
12/08/2020 17:06;That s why so many of my friends now call it the TrumpVirus We d go for Putin but realDonaldTrump has personally screwed America PressSec GOP senatemajldr RT Yamiche Another line from Kamala Harris speech that went directly to Pres Trump His flip flopping on social distancing wearing masks His delusional belief that he knows better than the experts All of that is reason amp the reason that an American dies of COVID every seconds ;1293670275029127168;@MacGregorGarlic
12/08/2020 17:06; BernieSanders It s obvious that Dictator Trump does not think to apply or does not care to apply the Golden Rule when it applies to politics His focus now is to use every lever of power available to him to win re election in and that includes cheating and Putin s help RT BernieSanders Unlike the very stable genius I m not a religious scholar But somewhere I read that pathological lying and providing tax breaks for the rich while ignoring the pain of the hungry the homeless and the sick is not exactly following the golden rule ;1293670216132521984;@EveCanadienne
12/08/2020 17:06;cThe best policy moving forward Ignore Putin s poison for our politics online Just ignore it Pass it by Don t react Don t refute Just block it and move on It s utterly unworthy of your time attention and energy ;1293670123010772993;@TomVMorris
12/08/2020 17:06;Russia s COVID vaccine is designed to give Vladimir Putin a ratings boost no matter what the cost Please There is no Russian vaccine It s all bullshit Putin is full of as much crap as Trump I mean they are truly made for one another Get a room Ha ;1293670095495901185;@iamtogtogiam
12/08/2020 17:05;Yes actually we did When Putin put out his b s bogus vaccine notice You just knew Trump was be all over it by today RT ImpeachmentHour So Trump says the US will buy doses of an untested unproven Russian Covid vaccine Anybody see this coming ;1293670073903624194;@JilWaters
12/08/2020 17:05;Oh and while I m at it save your breath I will never vote for THE RUSSIAN FEDERATION OF THE REPUBLICAN PARTY OF THE USA And I won t take Putin s vaccine RT GOPChairwoman Biden and Harris want to raise your taxes eliminate your health plan and send your utility bills through the roof That s not for the people It s for the radical left ;1293670055423676420;@sheron_spikes
12/08/2020 17:05;Putin responds to Biden selecting Kamala Harris for VP ;1293670012004102144;@BobRmhenry1
12/08/2020 17:05;She told of the truth here She always does When Putin stole the job for dump our economy had been running beautifully Shortly thereafter dump took his first bow for his accomplishment He s ruined us now Take a bow idiot boy You re crazy nasty RT TheRickyDavila Kamala Harris trump inherited the longest economic expansion in history from Barack Obama and Joe Biden And then like everything else he inherited he ran it straight into the ground ;1293669974842568704;@LvCa2
12/08/2020 17:05;So Putin has a new vaccine does he ;1293669887664173056;@fesi_df
12/08/2020 17:04;So realDonaldTrump are you going to condemn the RussianBountiesOnOurTroops or just praise Putin some more RT SenDuckworth Today would ve been a good day to condemn Putin for reportedly putting bounties on our troops realDonaldTrump But then again any of the last days since this story broke would have been good too ;1293669794449891328;@kmoliscollier
12/08/2020 17:04;via NYTimes can t wait for Trump to start pandering for US to start using this Russian scam ;1293669781095227394;@Dogmommaz3
12/08/2020 17:04; You kids right now should be paying attention to Belarus The USSR was not built in a day Putin has designs on Eastern Europe The worst part about it he knows it s attainable with a weakened United States Floor plan was laid years ago Might even threaten the Germans again ;1293669679953657856;@Raytown_12
12/08/2020 17:04;How long has Putin had the COVID vaccine under wraps Since October November December Now wouldn t THAT be ironic The Russian Virus let loose in the Chinese wet market in order to bring down it s greatest rivals the Chinese and Americans ;1293669652330156032;@WendyCreates
12/08/2020 17:04;I want to just say to the people of this country you have battled back from worst but the first thing you need to do is get rid of the Putin lover Donald Trump and Mike Pence;1293669649477967872;@JamesCharlesWa7
12/08/2020 17:03;ON THIS QAnon bandwagon Humans especially the uneducated simpletons are so damn EASY to Manipulate amp CON Do these idiots realize that this conspiracy is made and run by Russia trump is even a supporter All the easier now b manipulated by Putin Simply Unreal ;1293669587939143681;@rnadna2
12/08/2020 17:03;Bitching Mitch senatemajldr how s WINNING going You tired of winning Or are you only counting score for Trump and Putin RT TeresaShank glennkirschner Mitch puts the KY in Kentucky ;1293669585959280640;@mattfier
12/08/2020 17:03;Good one You need to think for yourself Do you like being told what to think Trump knows Putin put bounties on the heads of US soldiers WHY won t Trump stand up to Putin RT Lurabyss Klayoven Lrihendry Wrong We voted for Trump because he can t be controlled or bought by the puppeteers who have controlled DC for decades He was successful and wealthy BEFORE he became a politician not while he was in office like many tcot ccot MAGA KAG Democrats Riots WalkAway BLEXIT;1293669490832445440;@Klayoven
12/08/2020 17:03;Putin Russia first to approve COVID vaccine Source Reuters click here ;1293669430518480898;@cov_19worldstat
