Date;Tweet Text;Tweet ID;Screen Name
12/08/2020 04:03; Russia enacted a law in April which eliminated the requirement for Phase trials to be conducted before approval This has allowed researchers to fast track the vaccine development process sic Russia Putin CovidVaccineRace RT cnni Russia s coronavirus vaccine will be gradually rolled out to high risk people before a mass vaccination of Russians begins in October the head of the group funding the research said on Wednesday ;1293473154749407232;@EpicHermes
12/08/2020 04:03;Help I m stuck in Putin s white sticky stuff cobwebs ;1293473106292482050;@Papyrus_eBees
12/08/2020 04:02;Putin to Doctors Injecting Corona Vaccine to his Daughter ;1293473039653330944;@prashahahahant
12/08/2020 04:02;U S HHS Secretary Azar casts doubt on Putin s coronavirus vaccine claim;1293473023958417410;@CBSNews
12/08/2020 04:02;Putin says they ll have their RussianVaccine available for sale to other countries including the US by Oct Nov ;1293473005469872129;@kurgat_de
12/08/2020 04:02;Possibly the first time I ve been quoted in The Himalayan Times calling for prudent safety checks on the SputnikV COVID vaccine Russia becomes first country to approve a COVID vaccine says Putin;1293472988793372673;@duncan_matthews
12/08/2020 04:02;Galaxy brain take here that putin is indeed the biggest threat to America rather than uh checks notes all of the politicians running for office rn;1293472849068470273;@GrrlGhost
12/08/2020 04:02;Rigorously tested on opposition MPs and the daughter who complained too much Easy to administer dropped into your coffee when you go to the bathroom Vladimir Putin s vaccine was approved after tests on people via;1293472809449136128;@Seekingtruth517
12/08/2020 04:01;Hooray if Russia has actually made progress on a Covid vaccine but don t bet on it writes HolmanJenkins Russians playing with the COvid numbers and the efficacy of the alleged vaccine Sounds just like Trump and GOv DaSantis COVID ;1293472719263150081;@Commuternyc
12/08/2020 04:01;You lot only interested in lining your pockets and pandering to Putin Your time is up soon LockHimUp RT TeamTrump President realDonaldTrump We are stopping evictions The Democrats maybe they don t care but I care ;1293472682969890817;@windies4life
12/08/2020 04:01;America Has Had Years of Russian LED Leadership ItsTimeForAMERICANLeadership BidenHarrisAMERICANLeaders It s Time For America To Be LED By Real Americans NOT by Putin Proxies BidenHarrisRealAmericans America JoeBiden KamalaHarris;1293472649343979523;@DumpLiarTrump20
12/08/2020 04:01;Putin C OVID ;1293472643249655809;@readingandphilo
12/08/2020 04:01;Would you rather have more yrs of trump pence Putin and Barr And a weak GOP That ll do a lot for police reform RT briebriejoy We are in the midst of the largest protest movement in American history the subject of which is excessive policing and the Democratic Party chose a top cop and the author of the Joe Biden crime bill to save us from Trump The contempt for the base is wow ;1293472604490276864;@GierlakDavid
12/08/2020 04:01; Putin C Poten Cee pun RT Reuters Russia names new COVID vaccine Sputnik V in reference to Cold War space race;1293472579890507776;@ichheise_IX
12/08/2020 04:01; tags lf bts month full warranty no hold lf supplier direct supplier netflix freebie premium months bright paid apps giveaway ga cheapest artist year cheap solo spotify mura reseller exo php usd niki putin c RT exclusiveaccts SALE SALE SALE MONTH SOLO NETFLIX FULL WARRANTY CAN AUTORENEW EVERY MONTH NO WIPEOUT PESOS ONLY MOP GCASH LOAD DM TO AVAIL ;1293472572621721601;@exclusiveaccts
12/08/2020 04:01;Trump s dumpster fire of an administration gosh galloped right past it but let s not forget this craven traitor didn t even bring up to Putin the topic of the Russian bounties to the Taliban for the death of American troops This sell out doesn t care about American lives ;1293472566934306816;@BroheTycho
12/08/2020 04:00;Russia vaccine claim Putin is jumping the gun and trying to cut corners via YouTube;1293472433354297345;@LaowaiBlack
12/08/2020 04:00;patriotism is the last refuge of a scoundrel and the first resort of a Brexiteer up to his armpits in Russian money as he sells his country to Putin s mob RT mrjamesob The idea is more that they started ostentatiously hating on foreigners to spike the guns of people mocking their foreign sounding names A form of self defence Fran ois s mum is Italian Farage s last wife German but off they always go with the Commando comic WW patriotism ;1293472373325398016;@rosepoet
12/08/2020 04:00;The importance of Biden winning to slow the advance of global Fascism in November is huge With Putin s puppet out of the WH we may get some support in investigating how RussiaBoughtBrexit RT JoeBiden Let s go win this KamalaHarris ;1293472344703459334;@HolyMole
12/08/2020 04:00;Russian President Vladimir Putin announced the approval of a coronavirus vaccine called Sputnik V claiming it as a world first amid continued concern and unanswered questions over its safety and effectiveness ;1293472292073242625;@kxly4news
12/08/2020 04:00; Russia has developed the first vaccine offering sustainable immunity against the coronavirus President Vladimir Putin announced Tuesday BaghdadPost;1293472290630520832;@BaghdadPostPlus
12/08/2020 04:00; OnThisDay years ago the Kursk nuclear submarine sank in the Barents Sea killing all crew members on board Putin then in his first term as president would face intense criticism over the disaster;1293472290248593411;@MoscowTimes
12/08/2020 03:59;Don t understand how we can keep a president commander in chief n office who stands by Putin who paid bounty pymts to kill our servicemen does nothing This seems to b swept under the rug like other things Trump has done he is telling Putin amp others its ok RT SenDuckworth Today would ve been a good day to condemn Putin for reportedly putting bounties on our troops realDonaldTrump But then again any of the last days since this story broke would have been good too ;1293472226373783552;@ply32
12/08/2020 03:59;If Putin and Russian doctors have developed a safe and successful vaccine Covid then I will applaud them Fighting global disease should be a common cause not a geopolitical competition ;1293472221868912640;@McFaul
12/08/2020 03:59;Russia has a vaccine All heil Putin ;1293472199957938185;@BakhaiOsama
12/08/2020 03:59;Belarus will follow a multi vector foreign policy which I would summarize as follows pump as much money out of Russia as possible while at the same time seeking support from the AngloZionist Empire ;1293472197760122881;@ivan8848
12/08/2020 03:59;Coined it Putin finally won the Cold war ;1293472156089749504;@FableMak_DBN
12/08/2020 03:58;Putin C WHEEEEEZEEE ;1293472016041824256;@seoyehh
12/08/2020 03:58;Are you looking for a Logo Design for your brand You are in the right place our DesignMasterTeam would love to work on your project You can order here logo logodesign graphicdesign illustrator RahatIndori DEFENDAOLIVRO CovidVaccine putin;1293471909569376256;@DesignMaster100
12/08/2020 03:57; Russia Putin CovidVaccineRace A picture is equal yo a words ;1293471714328772609;@09mitali
12/08/2020 03:57;Seriously Who d want to go to China now Seriously Putin C;1293471671844614144;@AttyRossBart
12/08/2020 03:57;Putin says vaccine has been approved for use ;1293471604698157057;@NidalChami
12/08/2020 03:57;This message was bought and paid for by Vladimir Putin RT NRA JoeBiden and KamalaHarris will dismantle the Second Amendment ;1293471597806776320;@D_A_N_C_O_X
12/08/2020 03:57;Putin is pushing Portland sees and stands with Protesters in Minsk Beirut and everywhere people struggle against government violence corruption greed racism or other injustices Be water be strong Belarus RT BBCWillVernon We saw huge numbers of security forces chasing protestors into yards and beating them viciously with batons We also witnessed them firing stun grenades and tear gas at unarmed demonstrators Here is abdujalil s report from our night at the protest ;1293471540596490241;@mokvohk
12/08/2020 03:56;Putin COVID Cold War Clickbait RT DrRadchenko The most absurd take of the day award goes to CNN ;1293471488285315077;@DrKevorkO
12/08/2020 03:20;Putin apparently called his coronavirus vaccine Sputnik Fucken insane Remember the nuclear missile Satan I and II Putin spice ;1293462413094813696;@KVenator
12/08/2020 03:20;Thz Russian President Putin u are so brave love ppl u r hero invent the vaccines n test by yr daughter no word cam describe u i m so touching ;1293462386553131009;@ChinaTaiwan1c2s
12/08/2020 03:20;Russia says there is major information warfare against its coronavirus vaccine Russia vaccine Putin coronavirus;1293462339241545728;@HollyEllyatt
12/08/2020 03:20;BREAKING Country Approves st Corona Vaccine For Use Putin s Daughter Vaccinated;1293462262422749185;@AswiniMohanty13
12/08/2020 03:19;Dems already crying that Putin is meddling with election yet none of them supported Tulsi s bill to secure our elections At least TulsiExposedKamala ;1293462170852704257;@5ccollective
12/08/2020 03:19;Coronavirus and Vladimir Putin How to Save Sex For Coronavirus;1293462129677393920;@EvangeliTron
12/08/2020 03:19;School and college reopening announced Do watch the video and share to friends kalvigalaxy kalvigalaxyyoutubechannel corona virus coronavirus schools coronavirusmemes cornavirusmemes russia vaccine russianvaccine putin firstvaccine waitisover who immunity;1293462118923042817;@KalviGalaxy
12/08/2020 03:18;Putin says they ll have their RussianVaccine available for sale to other countries including the US by Oct Nov Will Trump buy it for Americans RussianVaccine;1293461966367883265;@_BeHuda
12/08/2020 03:18;Do you believe Putin about a vaccine I don t trust him at all Is he trying to help Trump ;1293461944880361473;@FrancieJones
12/08/2020 03:18;You might as well ask me to drink Lysol or inject Clorox into my veins I ll do that before I trust Putin s word that Russia has developed a vaccine for COVID RT HuffPost Having a vaccine and proving it is safe and effective are two different things he warned ;1293461786981793792;@ShelettaIsFunny
12/08/2020 03:18;Still putting bounties on our troops it s called a vaccine from Putin Military will be the guinea pigs RT SenDuckworth Today would ve been a good day to condemn Putin for reportedly putting bounties on our troops realDonaldTrump But then again any of the last days since this story broke would have been good too ;1293461769403465728;@JustJulie12345
12/08/2020 03:17;The primary ingredient in Vladimir Putin s vaccine is that nightmare fungus that ejaculates from a squirty bath toy when leave it full of water for a week ;1293461719163969543;@MatthewBevan
12/08/2020 03:17;Russia has been accused of acting recklessly by registering the world s first coronavirus vaccine just weeks into human trials But despite the scepticism President Putin claims it works and denies putting national prestige ahead of safety NEWS;1293461717049987072;@7NewsMelbourne
12/08/2020 03:17;Considering that Putin s favorite cure has always been Polonium yeah I d be concerned RT HuffPost Having a vaccine and proving it is safe and effective are two different things he warned ;1293461617804533760;@shaggyskunk
12/08/2020 03:17;Trump v Putin A Vaccine Manhood Contest;1293461606899126274;@jibodrift
12/08/2020 03:16; Putin I keep hearing how you are interfering with our elections to help POTUS However since we the people will actually be voting to re elect President Trump could you please help poor pathetic quid pro joe RT realDonaldTrump ;1293461458710343680;@Jane_says__
12/08/2020 03:16;That moment when Putin trolled everyone RT pelhambluefund oooh;1293461407929835521;@Iqbal_WHYUNO
12/08/2020 03:16;A total of nations from Latin America the Middle East and Asia have already requested doses of Russia s breakthrough coronavirus vaccine which was registered on Tuesday by Russian President Vladimir Putin ;1293461401080664066;@russia_mti
12/08/2020 03:16;Comrade Stalin is still great Please President Putin sing it too Russia Stalin evangelion Cool Soviet USSR CCCP Funny Putin RT Noor VTuber ;1293461395682426880;@p5599a
12/08/2020 03:16;It is wrong to release any vaccine without robust assessment safety efficacy This vaccine not been robustly assessed amp should not be released outside clinical trials Trust in vaccines amp vaccination is critical for public health for COVID amp all vaccines;1293461391672844289;@JeremyFarrar
12/08/2020 03:15;Le Putin after the announcement of RussianVaccine ;1293461167466319873;@ImteshalSarfraz
12/08/2020 03:15;Putin s pussy on the bus Vomit RT jadedcreative WOMEN FOR TRUMP BUS ;1293461146943524864;@peggydearey
12/08/2020 03:15;Experts are skeptical of Russia s claims warning that a widespread release of the vaccination could be dangerous ;1293460969470021632;@viceasia
12/08/2020 03:15; OpEd While Putin has asserted that Russia had won the vaccine race he is gambling with the health and safety of the Russian people lawrencegostin writes;1293460965850116096;@MoscowTimes
12/08/2020 03:14;Russia s so called approved vaccine hasn t even finished phase yet To distribute this rushed product to Filipinos and the world is unacceptable and just horrible science This is a public health crisis mr putin not an arms or space race pls inform ur friends btw RT PhilstarNews President Duterte has welcomed the offer of Russia for joint cooperation in fighting COVID and even volunteered to be a guinea pig for clinical testing On Tuesday Russia claimed that it has developed the world s first COVID vaccine READ ;1293460930689286144;@tin_tinola
12/08/2020 03:14;Trump v Putin A Vaccine Manhood Contest;1293460811088908292;@RogerKnisely
12/08/2020 03:14;A Bible Burning a Russian News Agency and a Story Too Good to Check Out This is how Russia is putting out disinformation in an attempt to rig our election in favor of Putin s strumpet ;1293460727479578625;@HotDoggerel
12/08/2020 03:14;Putin claims first coronavirus vaccine without providing evidence;1293460721733455874;@MichaelTJasper
12/08/2020 03:13;thousands in jail hundreds beaten up and tortured psychopath running the country guarded by legions of heavily armed zombie goons time to chat situation up on zoom belarus ukraine trump lukashenko putin russia borrell eu russia;1293460491373883392;@dronedept
12/08/2020 03:13;Trump v Putin A Vaccine Manhood Contest;1293460476412788736;@Eire353
12/08/2020 03:13;The fascist philosopher behind Vladimir Putin s information warfare YouTube;1293460470033072129;@ekoskaiphos
12/08/2020 03:12;It is now days since the story broke that Putin placed bounties on the heads of american troops and realDonaldTrump has done NOTHING IMPEACHED FOREVER;1293460440941563904;@telgray1
12/08/2020 03:12;Only phase trial has been completed and Putin says it s done What about clinical trials and Ans I have test it on my daughter RussianVaccine vaccine;1293460360830296064;@NirajBora3
12/08/2020 03:11;Seriously Vladimir Putin s vaccine was approved after tests on people via MailOnline;1293460188641583106;@peacefoodmusic
12/08/2020 03:11;Is John Selwyn Gummer advising Putin ;1293460134232981504;@paulwalteruk
12/08/2020 03:11;Ivan Ilyin Putin s Philosopher of Russian Fascism by Timothy Snyder The New York Review of Books;1293460034014175232;@dwatchnews_nam
12/08/2020 03:11;And given the ex Obama advisers which make up his foreign policy team Biden going for G making up with China giving the liberal evangelical neocons easy targets like Putin Modi while the woke complete the revolution at home RT c aashish has already been devastatingly tough But imagine post Nov situation Spectre of two front war Biden US President Hence Kamala Harris de facto decision maker Indian media focused on her liking idlis Perhaps Susan Rice as Secretary of State ;1293460033418608640;@lalashwa
12/08/2020 03:11;Me thinks comrade Putin might be behind all this;1293459979299479552;@Poolysanimate
12/08/2020 03:11;Russia registers Covid vax Putin s daughter in test group ;1293459968860000257;@DailyRahnuma
12/08/2020 03:11;Putin doesn t like losers and Lukashenko could have become a bit of a liability Also there s that awkward thing of Lukashenko claiming a bigger proportion of the vote than what Putin got ;1293459958177189889;@XSovietNews
12/08/2020 03:10;What s the betting that Putin next month makes large quantities of this new vaccine available to Trump to help his election prospects ;1293459858210074624;@Kinsellas
12/08/2020 03:10; Putin Says Russia Has Approved World s First Coronavirus Vaccine nytimes nytimesworld;1293459845581025281;@Tecnoestres
12/08/2020 03:10;Putin crapped himself with JoeBiden s VP pick Strong leadership Pushing around the Prez is coming to an end America is coming back ;1293459830166949888;@Bobellis10k
12/08/2020 03:10; Russia registers world s first coronavirusvaccine Putin announces;1293459825981104128;@AnNajamUsSaqib
12/08/2020 03:10;outlaw all soros co related ngos like Putin did all this nonsense will vanish his foot soldiers will die a natural death in terms of nuisance bangaloreriots;1293459811632201730;@abandraite
12/08/2020 03:10;Putin says Russia to register Gam COVID Vac vaccine under Sputnik V brand;1293459736147484672;@bneintellinews
12/08/2020 03:10;putin c;1293459718397140994;@anjelsborjer
12/08/2020 03:10;World leader s are all the same ego ego ego What do you think about Putin claiming that he s found a vaccine for COVID when a vaccine takes roughly years to make Tell mianomuchiri ItsAnneMwaura below amp tune into TheFuse on ;1293459707605155840;@TheFuse984
12/08/2020 03:09;Putin attempts to turn Covid vaccine into new Cold War;1293459596284051456;@swissbusiness
12/08/2020 03:09;Good luck Ms Harris The world needs new vision and smart people to take us forward Many are ready for the elderly blokes like Trump Biden Putin Xi Jinping to retire and let the new generation to run the world ;1293459578907054080;@PendanticBalwyn
12/08/2020 03:09;Russia registers COVID vaccine Putin says daughter already inoculated via nypost;1293459524427358213;@IlmariSepponen
12/08/2020 03:08; I won t be getting in line or this one either Vladimir Putin Russia Has Developed The World s First Treatment Shot via YouTube;1293459436552347655;@007Haarp
12/08/2020 03:08;covid vaccines names should be RUSSIA putin c CHINA vitamin xi USA cenTrump ;1293459405137035264;@5evahlovingLANY
12/08/2020 03:08;Every country needs to putin the same efforts as the Russia did ;1293459404621193216;@Tohieeeed
12/08/2020 03:08; Dutch Proud Freedom having max Weedplants on the balcony Example for the whole free world In Holland people have their own responsability dictatorship will not help Lesson for Trump Putin Erdogan bolsanaro telegraaf nrc NUnl WhiteHouse realDonaldTrump;1293459357515091969;@ABolsius2
12/08/2020 03:08;The Belarusian opposition has a smooth operating diplomat in Moscow Valery Tsepkalo Putin could easily work with a new leader If he refuses to support Lukashenko the regime s days really could be numbered ;1293459333875994624;@XSovietNews
12/08/2020 03:08;Russian whistleblower Grigory Rodchenkov who exposed widespread doping by athletes there said he s afraid he ll be assassinated on orders of President Vladimir Putin the AP reported whistleblower Russia Putin;1293459333662101506;@BlueprintGreece
12/08/2020 03:08; pvr to Putin s daughter;1293459306562482177;@Pawankumar8109
12/08/2020 03:08;Someone from Moscow developed first corona vaccine Meanwhile Putin to carryminati RussianVaccine;1293459206792548353;@NajmuSa71195651
12/08/2020 03:07;putin c is trending wtf ;1293459188614479874;@_rainaxx_
12/08/2020 03:07;Russia has become the first country in the world to grant regulatory approval to a COVID vaccine and one of Putin s daughters has already been inoculated but not mentioned which daughter COVID Vaccine Putin MariaVorontsova KaterinaTikhonova Putindaughter Sputnic;1293459118741524480;@Ramkshrestha
12/08/2020 03:07;When Putin says it s effective it s effective on Russians and Ukrainians The case rests RT republic AIIMS Director responds to Russia s Covid vaccine Need to see if it s safe effective ;1293459057064329216;@pratikpanchal06
12/08/2020 03:07;Russia claims it has made corona vaccine Russia RussianVaccine Putin Covid WHO rava;1293459009526259712;@ravapk
12/08/2020 03:07;Or Putin RT JeffreyToobin Please note that the words nasty shrill and strident are never used to describe male politicians ;1293458989976608768;@jrterrier5
12/08/2020 03:06;They are covering Belarus crackdown so unfavorably as if it were some kind of Gillets Jaunes stuff I don t presume to get into Putin s D chess strategy but are they perhaps purposefully trying to make Luka a complete international pariah so that he crawls back to Russia RT XSovietNews RT isn t showing much support for Lukashenko right now ;1293458937640103937;@Mortis_Banned
12/08/2020 03:06;ALERT Putin attempts to turn Covid vaccine into new Cold War Global Pandemic News Coronavirus COVID Protests ;1293458933785468930;@GlobalPandemics
12/08/2020 03:06;Not this teacher I ll be the first in line for a real vaccine not one from Putin RT likaluca If you think this is fun just wait until half the country refuses to get vaccinated ;1293458933642743808;@marymatt718
12/08/2020 03:06;The reset with Russia is one of the notable failures of Obama s foreignPolicy Strangely enough Trump takes more conciliatory approaches to Putin but MAGAmobs do not care MakeRussiaGreatAgain;1293458906782371840;@Heydar_Ross_K
12/08/2020 03:06;Moscow Mitch and Putin s Bitch are the traitors here RT Izziebettz DCJohnNorton gsmitthy SethAbramson Always projecting Always ;1293458844295675904;@williamjschill
12/08/2020 03:06;Smells like Putin to me RT Veronicaromm I m convinced QAnon is Roger Stones handiwork does anyone agree ;1293458781691695104;@zeusanna
12/08/2020 03:06;Russia discovers registers COVID vaccine Putin announces;1293458763849052160;@TheDailyNewsngr
12/08/2020 03:05;He s just trying to prevent his own Belarus in Russia by throwing out a juicy bone The vaccine either doesn t work or works at a low percentage rate like the one in China that is successful It s the illusion Of concern Putin is looking for RT whollyhell likaluca cindygallop Sounds like Putin will have one out in no time for all the early adopters out there ;1293458661528858629;@marymatt718
12/08/2020 03:05;Experts have expressed serious concerns after Vladimir Putin said Russiahad approved the world s first coronavirus vaccine following less than two months of human testing ;1293458647117332480;@Milanowekpet
12/08/2020 03:05;PUTIN C IS TRENDING I HATE U GUYS HAHAHAHAHHA IT S SO FUNNY I CAN T ;1293458606319255552;@reneerhose
12/08/2020 03:05;The UAE and Russia Have Shared Interests in the Middle East gulfstateanalyt via myfairobserver;1293458583825395712;@olivierstevens
12/08/2020 03:05; Putin Lukashenko ZelenskyyUa For your information RT ganimed ;1293458579521974272;@AlinkaKalinka
12/08/2020 03:04;Russian vaccine for Covid named after the world s first satellite by the Soviet Union has been approved by Moscow Putin admits that his daughter volunteered to get vaccinated and she actually feels good Is someone fooling someone ;1293458424496300032;@TheBoB_show
12/08/2020 03:04;Russia announces Covid vaccine Meanwhile trump and putin ;1293458386479022081;@Raw_Bee
12/08/2020 03:04;Meduza special correspondent Maxim Solopov who was reportedly beaten and arrested while covering protests in Belarus belarus solopov media journalists protests europe russia putin mkt;1293458366593867776;@BoilerRoomTweet
12/08/2020 03:04; maybe Putin is trolling Trump ;1293458266949746689;@n3w4v3
12/08/2020 03:04;Putin s plan for Russia s coronavirus vaccine is at high risk of backfiring expert says;1293458202382696448;@CaptainCyril
12/08/2020 03:03;I Love Twitters I Love USA I Love Trump I Love Russia I Love Putin I Love EU I Love NATO ;1293458180811284480;@Edward733
12/08/2020 03:03;Only a Putin thing to be as bold as to say shit like this RT business BREAKING Vladimir Putin says Russia has registered the world s first Covid vaccine and discloses that one of his own daughters has already received it;1293458069880475648;@brianbyname
12/08/2020 03:03;Britain becomes a tiny unimportant little Straight Banana Republic ruled over by third rate failures fighting amongst themselves for the last rancid scraps of power in a country powerless to resist the bullying of Trump Putin Oh hang on That s already happened RT UKGovtGoogles what s the worst that can happen as a result of crushing economic collapse ;1293458054453829634;@caracal
12/08/2020 03:03; Russia formally approves COVID vaccine To prove that it s safe and works President Vladimir Putin said his own daughter has been inoculated in an early testing phase and ran a slight fever on the first day but her temperature dropped to normal;1293457981540106241;@observerug
12/08/2020 03:02;Hey AmericanCitizens putin ALMOST WON all us are sitting by and watching putin injected the virus putin injected the mishandling and putin is the savior NOPE HE is the inventor of this Chaos the constant mental terrorism and the newest beginning da end fputin;1293457875025580033;@kittykatty2020
12/08/2020 03:02;Will he try to send someone to arrest BIDEN Obama He has BARR as his dictator FIXER amp a pathetic lap dog Blame the RUSSIAN treason HOAX on Obama He said Russia wanted Hillary to win amp not him After Putin has said he wanted amp helped TRUMP RT SethAbramson Just want to confirm for those of you who wisely don t watch Trump that yes he did accuse Biden of high treason at his presser and in so doing implied that not only is Biden a criminal but should be executed That s how dangerous Trump is Don t ever forget it Not for a second ;1293457846823268354;@birdyyodas
