,Twitter Query: #VotoDeConfianza lang:es -filter:retweets -filter:replies,,,,,,,,,,,,,,,,,,,
11/08/2020 20:54,@AxelRamirezB,Axel Ramirez,"Tras casi 12 horas de debate, el Congreso acordó darle el #VotoDeConfianza al gabinete ministerial liderado por el premier #WalterMartos. 115 parlamentarios votaron a favor, 5 en contra y 4 se abstuvieron.",1293365100536107008,,,,0,1,Twitter for Android,185,793,5,,5/04/2011,Lima,"Licenciado en Periodismo y Comunicación con experiencia en gestión pública y medios escritos. Políticamente incorrecto. ""No hay nada peor que el doble rasero"".",,,View
11/08/2020 20:53,@RosaTolerante,Rosa Maria 📌 “tolerante”,"Al fin, congreso le dio el #VotoDeConfianza a Walter Martos y a su gabinete. 115 votos a favor 5 en contra 4 abstenciones Buena suerte al Premier, el camino es largo y el tiempo corto.",1293365082798292992,,https://pbs.twimg.com/media/EfL0r0gWsAEYmcj.jpg,,4,10,Twitter for iPhone,4948,163,3,,2/05/2020,Narnia,Parodista conocida por ser excesivamente “tolerante”,,,View
11/08/2020 20:53,@myescab,Myriam Escalante,"Martes, Martos obtuvo el #VotoDeConfianza",1293364873800318982,,,,0,0,Twitter for iPhone,372,318,8,,13/05/2010,"Lima, Peru","Estudiante de Comunicación Social de la UNMSM, #fotografía #ciencia #arte Facebook-Instagram: @myescab",https://www.facebook.com/mairyea,,View
11/08/2020 20:53,@PilarLez,Maria Pilar Lezama,¡Por fin se le dio el VOTO DE CONFIANZA al GABINETE MARTOS! ☝️☝️#VotoDeConfianza #GabineteMartos RT @martinhidalgo: #Congreso2020EC: Pleno le otorga el voto de investidura al Gabinete Ministerial de #WalterMartos. Esta fue la votación. vía @Politica_ECpe,1293364865541824517,https://twitter.com/martinhidalgo/status/1293362137541246977,https://pbs.twimg.com/media/EfLx7wnXoAEpbgq.jpg,,0,0,Twitter Web App,85,111,0,,24/04/2016,"Cusco, Peru",Futura Arquitecta Cusqueña - Fotografía 📸 - Viajes 🏕️ - Política en formacion 💜,https://www.facebook.com/pilar.lezamag,,View
11/08/2020 20:52,@jhonoriovidal,Jessica HonorioVidal,"El @congresoperu ha dado el #VotoDeConfianza para el Gabinete @WalterMartosR, saludo la decisión responsable y coherente. No hay más excusas, a partir de este momento se necesita ver el trabajo y empuje de los ministros, necesitamos verlos en acción y poniendo #ElPerúPrimero 🇵🇪.",1293364706141523968,,,,0,1,Twitter for Android,233,120,4,,26/08/2014,"Rimac, Peru","Peruana. Política. Amante de la vida y el café. No puedo cambiarlo todo, pero puedo cambiar yo.#Alegre #Risueña 🤗",,,View
11/08/2020 20:51,@4carlosantacruz,Carlos Santa Cruz,"Abrumadora mayoría le otorgó el voto de confianza a nuevo premier. Toda la mejor buena vibra para su gestión! Pero en los siguientes días intentarán censurar al ministro de educación y la ministra de economía... #VotoDeConfianza #Peru RT @kikesitov67: #LOULTIMO Pleno del congreso otorgó la confianza al gabinete ministerial presidido por Walter Martos. 115 votos a favor, 5 en contra y 4 abstenciones @RPPNoticias",1293364505741844483,https://twitter.com/kikesitov67/status/1293362945368481794,,,0,0,Twitter for iPhone,246,1603,1,,15/09/2011,Lima,Otro mundo es posible,,,View
11/08/2020 20:51,@jeremyfalconf,Jeremy Falcón Flores,"#ULTIMAHORA el congreso de la república del Perú otorga el #VotoDeConfianza al #GabineteMartos, tras más de 12 horas de debate, que finalizó con 115 votos a favor, 5 en contra y 4 abstenciones.",1293364500956172293,,https://pbs.twimg.com/media/EfL0J28WkAElNpg.jpg,,0,0,Twitter for Android,42,249,0,,19/10/2018,"Lima, Peru","peruano por siempre 🇵🇪, amo por siempre la música 🎶 y las noticias 📰 me gustan los retos y conseguir mis sueños y el éxito. #QuedateEnCasa",,,View
11/08/2020 20:51,@JotaLopezbotel1,Jota Lopez @botellitadejerez,"El Congreso da su #VotoDeConfianza al gabinete Martos, Cateriano en estos momentos debe estar revolcandose.",1293364498691231746,,pic.twitter.com/bxVuQwdX3q,,1,1,Twitter Web App,21,150,0,,2/11/2018,,,,,View
11/08/2020 20:51,@rob_altamirano,Roberto Altamirano,#VotoDeConfianza pasó con 115 votos el #GabineteMartos en el @congresoperu el jueves va el ministro de @MineduPeru por la interpelación. A ver qué pasa,1293364496375980034,,,,0,0,Twitter for Android,3313,480,20,,26/08/2014,,Licenciado en Periodismo. Redactor - productor - conductor - locutor de noticias en Capital radio y tv,,,View
11/08/2020 20:51,@GFlores83,Guillermo Flores Borda,"¿Cómo tomará esto Pedro Cateriano? Respaldo casi unánime del Congreso al nuevo gabinete #VotoDeConfianza RT @CarloMagno21: Tras mensaje final del presidente del Consejo de Ministros, Walter Martos, que en tono conciliador y sentido señaló que ""al escuchar a los congresistas escucha al pueblo que habla a través de ellos"", obtiene el #VotoDeConfianza con 115 votos a favor, 5 en contra y 4 abstenciones.",1293364392814313473,https://twitter.com/CarloMagno21/status/1293363528917757953,https://pbs.twimg.com/media/EfLzRmnXsAIY41z.jpg,,1,2,Twitter Web App,973,1505,3,,6/07/2011,Lima,Esposo de @MichaelaJohnke Profesor de derecho financiero/game theory/religión & política. Máster en Derecho por University of Chicago. Opiniones personales.,,,View
11/08/2020 20:51,@GeneralDelAire1,General del Aire - El Bloqueado - #GeneralDeTodos,#LoUltimo Walter Martos recibe el #VotoDeConfianza Recibió nada más cinco votos en contra: 4 del Frente Amplio y 1 de UPP.,1293364365165559808,,,,2,33,Twitter Web App,12547,1048,11,,22/10/2019,Willax TV,"Ayudaré a todos. Si quieren ignorar la ley, llámenme. Esta cuenta es más parodia que la huelga de hambre de Mark Vito. Cuenta de apoyo: @GeneralDeTodos",https://www.instagram.com/generaldelaire1/,,View
11/08/2020 20:50,@Rocio_BarriosAl,Rocío Barrios Alvarado,Con el liderazgo del presidente @MartinVizcarraC y el premier @WalterMartosR trabajaremos arduamente con un solo objetivo: apoyar a todos nuestros compatriotas. Venceremos esta crisis unidos. Agradezco al @congresoperu por el #VotoDeConfianza. ¡El Perú siempre estará primero!,1293364266960134145,,https://pbs.twimg.com/media/EfLz453XgAI-aTq.jpg,,4,21,Twitter for Android,6764,134,21,,15/03/2019,,Abogada con postgrado en Finanzas y Derecho Empresarial y egresada de maestría en Gestión Pública. Actual ministra de Comercio Exterior y Turismo.,,,View
11/08/2020 20:50,@Ricardohrivero,Emilio Horna Rivero,"Se viene la interpelación a la ministra de economía y al ministro de educación. Vayan diciéndoles adiós, porque esto está más que cantado. #VotoDeConfianza RT @Ricardohrivero: 115 votos a favor, 4 abstenciones y 5 en contra. El gabinete de Walter Martos ha recibido el voto de confianza por el congreso de la república. Este gabinete es muy similar al antiguo, con esto queda claro que anteriormente negaron el voto por joder. #VotoDeConfianza",1293364241710407681,https://twitter.com/Ricardohrivero/status/1293363222251220992,,,1,1,Twitter Web App,398,626,3,,18/08/2009,Chiclayo - Perú,"Dicen que soy marketing manager, pero soy un solucionador de problemas, ingeniero industrial y adicto a la chatarra. En mis tiempos libres me creo #podcaster",https://linktr.ee/espacio.alterno,,View
11/08/2020 20:50,@hjorgea,El George,"Los de Frente Amplio que quieren tener a Goyo, Verónika, y tanto inepto izquierdista en la PCM para votar a favor ??? #VotoDeConfianza",1293364179181731841,,,,0,0,Twitter for iPhone,97,627,6,,24/10/2011,,"Ni bueno, ni malo",,,View
11/08/2020 20:50,@reinhardarana,Reinhard Arana,"ahora que el nuevo gabinete tiene el #VotoDeConfianza, por favor que se ponga a trabajar, ojalá que tomen buenas decisiones, el Perú lo necesita",1293364150006099968,,,,0,0,Twitter Web App,303,387,5,,13/06/2009,Lima-Perú,"Ing de sistemas, MBA, limeño, tecnología, música, conciertos, 90s, memes, cuestionador, conversador, desarrollo sostenible, fútbol, hincha de Sporting Cristal",,,View
11/08/2020 20:49,@CarlosGGarcia_,calitos,Solo el Frente Amplio votó en contra del #VotoDeConfianza. A ver si los tildan de obstruccionistas y enemigos de la democracia.,1293364069055987712,,,,3,4,Twitter Web App,2537,267,17,,13/01/2010,Lima,Reserva moral de mi casa.,http://instagram.com/cgarcia.11,,View
11/08/2020 20:49,@mpalacios76,Mario,"#WalterMartos consiguió #VotoDeConfianza para su gabinete. Y fue por goleada, 115 votos a favor, 5 en contra y 4 abstenciones. Ahora que trabaje y cumpla lo prometido. #Perú #NOTICIA",1293363921710129155,,,,0,0,Twitter for Android,1007,1331,6,,7/03/2013,Lima,Periodista del Grupo La República. Gusta de la buena música y lectura.,,,View
11/08/2020 20:49,@erickjohn26,Erick Gastañaduy,"#votodeconfianza Está vez sí aprobaron la confianza al gabinete y el pleno terminó a una hora prudente (no a las 6am) 115 a favor, 5 en contra y 4 abstenciones",1293363906644258818,,https://pbs.twimg.com/media/EfLzm-SX0AUMQ9i.jpg,,0,1,Twitter for Android,397,608,6,,27/03/2010,Lima - Perú,"Periodista. Hincha de Universitario, amante del buen cine, gamer de fines de semana, y orgullosísimo papá de Ana Paula",,,View
11/08/2020 20:49,@ErickPGC,Erick Guardamino,"Con 115 votos a favor, 5 en contra y 4 abstenciones se aprueba en el pleno del congreso la cuestión de confianza al presidente del Consejo de Ministros, Walter Martos. #VotoDeConfianza",1293363833323638784,,,,0,0,Twitter for Android,184,72,0,,3/04/2020,,,,,View
11/08/2020 20:48,@gonzaguilarsosa,Gonzalo Aguilar Sosa,🇵🇪 | Congreso de la República (@congresoperu) otorga el #VotoDeConfianza al Presidente del Consejo de Ministros (@pcmperu) Walter Martos (@WalterMartosR) y los resultados se dieron de la siguiente manera: ✅ 115 votos a favor ❌ 5 votos en contra 🏳️ 4 abstenciones,1293363783327506433,,https://pbs.twimg.com/media/EfLyorbX0AY7bDv.jpg,,0,0,Twitter Web App,535,239,0,,10/06/2018,"Lima, Peru",• Cuenta Oficial • IG: http://instagram.com/gonzaguilarsosa • FB: http://facebook.com/gonzaguilarsosa • Contacto 📩 g.aguilarsosa03@gmail.com,,,View
11/08/2020 20:48,@peruqp,Tiffani 🌷,Tantas horas hasta que por fin otorgaron el #VotoDeConfianza,1293363770643959815,,,,0,1,Twitter for Android,587,199,5,,2/05/2010,Piura .Peru,"Abogada tuitera, defiendo la pluralidad del pensamiento, respeto todas las ideologías y soy democrática . Dios te ama 🙏",http://www.interquorum.org,,View
11/08/2020 20:48,@NatalieCondoriJ,NATALIE CONDORI,"El Congreso de la República @congresoperu otorga el voto de confianza al Gabinete de @WalterMartosR, ""que nunca digan que no fuimos capaces de unirnos"" #VotoDeConfianza",1293363762121134080,,https://pbs.twimg.com/media/EfLzfLYXoAEbGv5.jpg,,0,1,Twitter for Android,13214,4430,48,,30/04/2013,Perú,Ingeniera Comercial ex Congresista de la República del Perú y ex Primera Vicepresidenta de la mesa Directiva 2015-2016,http://www.nataliecondori.pe/,,View
11/08/2020 20:48,@quiroztuvoz,Jheydi Quiroz,Belaunde siempre dijo que un Político tenía que tener sentimientos y no vivir de resentimientos. Hoy #AccionPopular ha dado muestras de ser una Bancada critica pero mirada al futuro y brindó el #VotoDeConfianza a @WalterMartosR,1293363738133893120,,https://pbs.twimg.com/media/EfLy9-bXoAAu2UJ.png,,0,5,Twitter Web App,1018,2668,3,,21/03/2010,PUCP,"Regidora Metropolitana @munilima |Pdta.Comisión de Comercializacion, Def.Consumidor y Transporte| Abogada @PUCP| Catedrática| Sec.Nac.Mujer @AccionPopular",,,View
11/08/2020 20:48,@puentepedrino,RadarPuentepedrino,#ÚLTIMOMINUTO APRUEBAN CUESTIÓN DE CONFIANZA 115 votos a favor 5 en contra 4 abstenciones Aprobada la cuestión de confianza. #VotoDeConfianza,1293363708618518528,,https://pbs.twimg.com/media/EfLzcDqXoAYimQQ.jpg,,0,1,Twitter for Android,14,92,0,,18/05/2020,,"Te informamos y también te servimos, desde Puente Piedra cubrimos la información del distrito, Lima Norte y el país",,,View
11/08/2020 20:48,@parapioggia,Tad.Zio 🌈soy gay y no me compadezcas.,"no soy hincha del INUTIL DE VIZCARRA, pero era VITAL DARLE #VotoDeConfianza, su gobierno tiene 11 meses de vida. ESPERO QUE ESTE GABINETE ENMIENDE EN ALGO LAS BURRADAS DE VIZCARRA, y que el PUEBLO PERUANO sea responsable con su salud. EL estado NO PUEDE SER NIÑERO DE TODO UN PAIS",1293363661281558531,,pic.twitter.com/apLtjW0Ndi,,0,0,Twitter Web App,174,62,0,,21/02/2015,Orbis Tertius,"GAY CENTRISTA ATEO, SÓLO 2 GÉNEROS, NO al MATRIMONIO GAY O HETERO; NO al FEMINISMO REVANCHISTA, al SOCIALISMO/COMUNISMO, al FUJI-APRISMO; CIENCIA sobre RELIGIÓN",,,View
11/08/2020 20:48,@SilvaAbogados,Estudio Silva Abogados,El #premier Walter Martos expuso el #plandegobierno y solicitó el #votodeconfianza,1293363659050307589,https://buff.ly/3fSliui,,,0,0,Buffer,90,543,1,,9/03/2018,"Lima, Peru",Ejercemos el Derecho para solucionar tus problemas.Somos una firma de abogados que brindamos asesoría legal integral a nuestros clientes(En Perú y Extranjero).,http://www.silvabogados.com,,View
11/08/2020 20:48,@GeneralDelAire1,General del Aire - El Bloqueado - #GeneralDeTodos,"El #VotoDeConfianza es otorgado al premier Walter Martos. Cinco congresistas votaron en contra, por llorones.",1293363613181378560,,,,5,60,Twitter Web App,12547,1048,11,,22/10/2019,Willax TV,"Ayudaré a todos. Si quieren ignorar la ley, llámenme. Esta cuenta es más parodia que la huelga de hambre de Mark Vito. Cuenta de apoyo: @GeneralDeTodos",https://www.instagram.com/generaldelaire1/,,View
11/08/2020 20:48,@ssoulblue,Geraldine Arellano,"115 votos a favor,5 en contra y 4 abstenciones se le otorga el voto de confianza al Gabinete Martos. Era predecible. OJO:se viene la interpelación al ministro de educación este jueves. #VotoDeConfianza",1293363611558203392,,,,0,7,Twitter for Android,3002,218,2,,15/07/2014,,Chiclayana. 💛🐍 Sin bandera política.,,,View
11/08/2020 20:48,@MiltonVV,Milton Vela Valencia 🕸☕️,"#VotoDeConfianza👍🏻, pero atentos con las interpelaciones... RT @martinhidalgo: #Congreso2020EC: Pleno le otorga el voto de investidura al Gabinete Ministerial de #WalterMartos. Esta fue la votación. vía @Politica_ECpe",1293363590012051457,https://twitter.com/martinhidalgo/status/1293362137541246977,https://pbs.twimg.com/media/EfLx7wnXoAEpbgq.jpg,,1,1,Twitter for iPhone,11379,3611,342,,15/03/2009,Lima ✈️ Barcelona,CEO @CafeTaipa Consultor en #reputación Pasión: Sumarle confianza al mundo a través del marketing Speaker🎤Autor📔@PlanetaLibrosPe: #DeLaAtracciónALaConfianza,https://event.webinarjam.com/channel/REVELATE,,View
11/08/2020 20:48,@FuerzaRoja200,Ariel 🌺,Vizcarra 4 Congreso 0 #VotoDeConfianza,1293363585436004358,,,,0,0,Twitter Web App,126,216,0,,19/05/2018,,Cuenta de apoyo a @SaidPalao_fit,,,View
11/08/2020 20:47,@fpbarranco1,Fuerza Popular - Barranco,"Ultimo Minuto : El Congreso Otorga VOTO DE CONFIANZA AL NUEVO GABINETE con 115 votos a favor,5 en contra y 4 abstenciones . #VotoDeConfianza @luchootoya @WalterJibaja2 @ColumbusOpina @JovenesKmiraflo @milytakayama @KeikoFujimori @LuzSalgado_R @susana_bozzo @MarthaChavezC",1293363528917815297,,,,0,0,Twitter for Android,1260,1438,1,,13/05/2019,"Barranco, Peru","Demostrando que con Unidad ,Lealtad y Disciplina podemos lograr mucho por nuestro País.",https://www.facebook.com/Fuerza-Popular-Limaco-Barranco-1404637366415021/,,View
11/08/2020 20:47,@CarloMagno21,Carlo Magno Salcedo,"Tras mensaje final del presidente del Consejo de Ministros, Walter Martos, que en tono conciliador y sentido señaló que ""al escuchar a los congresistas escucha al pueblo que habla a través de ellos"", obtiene el #VotoDeConfianza con 115 votos a favor, 5 en contra y 4 abstenciones.",1293363528917757953,,https://pbs.twimg.com/media/EfLzRmnXsAIY41z.jpg,,0,2,Twitter for Android,2397,595,15,,29/01/2010,Lima,Secretario Nacional de Doctrina del Partido Morado. Profesor de Ciencia Política de San Marcos y de Derecho de San Martín de Porras. Consultor.,http://blog.pucp.edu.pe/carlomagnosalcedo,,View
11/08/2020 20:47,@aalmanzagaray,Ana,Nuestro voto de confianza @WalterMartosR confiamos en su buena voluntad con todos los Peruanos #VotoDeConfianza,1293363525012926464,,,,0,0,Twitter Web App,10,217,0,,1/08/2014,,,,,View
11/08/2020 20:47,@TonyTorresArias,Anthony Torres Arias,"#VotoDeConfianza 115 a favor 5 en contra 4 abstenciones Que tal cifra las de aprobación, por confirmar si es el pedido de voto de confianza con mayor número de cifras a favor.",1293363490846121988,,,,0,0,Twitter for Android,3,108,0,,6/12/2011,,,,,View
11/08/2020 20:47,@edisonral,Edison Rentería,"Pleno del Congreso aprueba el gabinete Martos con: 115 votos a favor, 5 en contra y 4 abstenciones. #VotoDeConfianza",1293363487494868992,,,,0,0,Twitter for Android,1235,981,21,,17/06/2013,Chiclayo,Comunicador social y periodista. Sigo siendo aprendiz de la vida. Escritor a tiempo incompleto. 😉,http://instagram.com/@ghersyedison,,View
11/08/2020 20:47,@AnibalDonayre,Aníbal Donayre,Merino de Lama le dijo a Cateriano que no darían confianza si insistían con ministro Benavides en educación y Alva en economía. Hoy le dan la confianza a Martos con Benavides en educacion y Alva en economía. ¿Fue chantaje? #VotoDeConfianza,1293363475251593216,,,,0,0,Twitter for Android,73,171,0,,23/04/2011,,Datos - Información - Conocimiento - Decisiones Correctas,,,View
11/08/2020 20:47,@pedrosiura,Pedro Siura,"Un Gabinete con ministros cuestionados por nepotismo y corrupción, sin un planeamiento claro para enfrentar la pandemia, con un gasto público poco transparente y en muchos casos deficiente y equivocado #VotoDeConfianza RT @congresoperu: 🔴#LoÚltimo I #PlenoVirtual otorga la Cuestión de Confianza, planteada por el presidente del Consejo de Ministros, Walter Martos Ruiz, con 115 votos a favor.",1293363470059163648,https://twitter.com/congresoperu/status/1293362039717605377,https://pbs.twimg.com/media/EfLx6mpXgAI-U5B.jpg,,2,3,Twitter for Android,1919,833,7,,26/06/2010,,Formado en el Derecho mas no por ello un legalista irracional. Interesado en el hecho político pero alejado de la simpleza de las ideologías retardantes. PERÚ,,,View
11/08/2020 20:47,@robertoduran93,Roberto,No puede seguir existiendo el voto en abstención. Es Yay or Nay. #VotoDeConfianza #plenovirtual,1293363387095822336,,pic.twitter.com/BcK4XFqub2,,0,0,Twitter Web App,81,615,1,,31/05/2009,Lima,Abogado que le gusta la pizza con piña.,https://open.spotify.com/user/spotify/playlist/37i9dQZF1DWWc7DUy0p0AE?si=R-XvJnGFQ6KcIWlgk18mzg,,View
11/08/2020 20:47,@ApBancada,Bancada Acción Popular,"🚨 Noticias en Acción ¡Seguimos trabajando en beneficio del Perú! Nuestros congresistas escucharon atentamente el Pleno de #VotoDeConfianza al Gabinete Martos, asimismo expresaron las diversas necesidades y requerimientos de las regiones que representan. ¡Saldremos #Adelante!",1293363347241480193,,pic.twitter.com/860iDwGICM,,1,4,Twitter Web App,361,242,6,,20/05/2020,,"Bancada Acción Popular. Con una sola bandera, la del Perú. Con un solo Himno, el de la Patria. Con un solo lema, ¡Adelante!",,,View
11/08/2020 20:47,@pattyulloque,Patricia,"115 votos a favor, 5 en contra y 4 abstenciones. ¿Hay antecedentes de un #VotoDeConfianza con esta votación? Margen #AFavor sumamente amplio.",1293363327326986240,,,,0,8,Twitter Web App,7638,973,49,,3/07/2011,"Lima, Peru",Comunicadora y periodista en acción. Ideas y opiniones personales. Hoy en @noticias_tvperu #TvPerú Instagram @pattyulloque,,,View
11/08/2020 20:46,@CristhianRS,Cristhian Rojas S,Se dio el #VotoDeconfianza al gabinete de Walter Martos. 115 votos a favor.,1293363320012124167,,,,2,18,Twitter for iPhone,10511,2129,111,,20/05/2009,"Lima, Perú","Comunicador y magíster en ciencia política. ¿Temas? Politica, historia, música, arte. Mochica y wanka. Presidente de @EsMomento_pe #HeForShe #Progresismo",https://www.instagram.com/cristhianrs/,,View
11/08/2020 20:46,@JChavez_2209,Josué Chávez,"Que el Frente Amplio vote en contra y en abstención en una situación compleja como la pandemia, solo quiere decir que no tenemos izquierda en el Congreso. #VotoDeConfianza",1293363302639243269,,,,0,0,Twitter for iPhone,1093,1011,6,,26/02/2014,"Jesús Maria, Peru",Opinión en base a datos || Periodismo || hincha de @Universitario || #QuedateenCasa,https://www.instagram.com/josuegabriel1.0/,,View
11/08/2020 20:46,@flaminhott4,jennifer||🦋,Frente amplio: 3 abstenciones 3 votos en contra #VotoDeConfianza,1293363289255227392,,,,0,0,Twitter Web App,30,47,0,,26/05/2020,"Lima, Peru",Feminista💥.,,,View
11/08/2020 20:46,@Compartetuopini,Edda Gonzales 🇵🇪,"#VotoDeConfianza ¿Para qué existe el voto de abstención, ¿ah? Es ""sí"" o es ""no"".",1293363278467534850,,,,0,0,Twitter for Android,1497,304,8,,31/05/2012,,"Solo sé que la vida sin música no es vida. Me molesta la injusticia, la hipocresía y la doble moral de ciertas personas. Solo escribo lo que pienso. Lima-Perú.",,,View
11/08/2020 20:46,@cin_deli,Mar ❤,5 congresistas que siguen haciendo pataletas porque no le dieron su caramelito y unas cuantas abstenciones propias de cobardes!!! 🤷‍♀️ #VotoDeConfianza #GabineteMartos,1293363242861985793,,,,0,1,Twitter for Android,11553,3108,8,,4/08/2011,Perú,"Que todo fluya, que nada influya!!! 🍃🌞 💙💪",,,View
11/08/2020 20:46,@elblogdebinario,BiNaRiO,Finalmente le dieron el #VotoDeConfianza al Gabinete Martos. Solo tuvo 5 votos en contra de los cuales 4 fueron del Frente Amplio y 1 de Unión por el Perú. RT @martinhidalgo: #Congreso2020EC: Pleno le otorga el voto de investidura al Gabinete Ministerial de #WalterMartos. Esta fue la votación. vía @Politica_ECpe,1293363237258432513,https://twitter.com/martinhidalgo/status/1293362137541246977,https://pbs.twimg.com/media/EfLx7wnXoAEpbgq.jpg,,0,1,TweetDeck,8602,4356,116,,1/06/2007,"Lima, Perú","Comunicador audiovisual del día a día, administrador de profesión. Me interesa la política. De izquierda gramsciana. Militante @sembrarperu del @FrenteAmplioPe",http://www.facebook.com/elblogdebinario,,View
11/08/2020 20:46,@Ricardohrivero,Emilio Horna Rivero,"115 votos a favor, 4 abstenciones y 5 en contra. El gabinete de Walter Martos ha recibido el voto de confianza por el congreso de la república. Este gabinete es muy similar al antiguo, con esto queda claro que anteriormente negaron el voto por joder. #VotoDeConfianza",1293363222251220992,,,,1,2,Twitter Web App,398,626,3,,18/08/2009,Chiclayo - Perú,"Dicen que soy marketing manager, pero soy un solucionador de problemas, ingeniero industrial y adicto a la chatarra. En mis tiempos libres me creo #podcaster",https://linktr.ee/espacio.alterno,,View
11/08/2020 20:46,@GloriaMonteneg,Gloria Montenegro,"#VotoDeConfianza 👍🏼🇵🇪Después de 12 horas, 115 congresistas votaron a favor! Walter Martos tiene la confianza del Congreso. Se abre al camino para un trabajo conjunto en época de pandemia! Vamos Perú 🇵🇪",1293363123337011200,,https://pbs.twimg.com/media/EfLy5tOXgAACI4O.jpg,,13,88,Twitter for iPhone,63998,980,112,,7/07/2014,Trujillo - La Libertad,"Exministra de la Mujer y Poblaciones Vulnerables, ex congresista de la República. Fiel defensora de los derechos humanos y promotora del desarrollo de la MUJER.",https://www.facebook.com/gloriamontenegrof?ref=hl,,View
11/08/2020 20:46,@ovillo_sergio0,Sergio Ovillo Meléndez,#VotoDeConfianza: Al menos no tendremos que amanecernos escuchando un eterno debate.,1293363098028474368,,,,0,0,Twitter Web App,7,266,0,,15/10/2018,Peru,"Periodismo | Amante de la música | Puedo conversar de cosas interesantes, creo.",,,View
11/08/2020 20:46,@vadith,te amo 🇵🇪,"115 a favor, 5 abstenciones, 5 en contra 👏🏽 👏🏽 👏🏽 #VotoDeConfianza #ElPeruPrimero",1293363092194234371,,,,0,0,Twitter for Android,234,895,7,,28/12/2009,Peru,,,,View
11/08/2020 20:46,@PeruanoComunica,Peruano en cuarentena,"Cateriano, no. Y si al gabinete Martos. Que cambió o que prometió? #VotoDeConfianza",1293363070492987397,,,,3,19,Twitter Web App,44922,1227,57,,13/01/2015,Peru,Identificar a CABECILLAS de las ORGANIZACIONES CRIMINALES de saco y corbata que roba y destruye al pueblo. #ApraFujimontesinismoNuncaMas! #TerrorismoNuncaMas!,http://www.PeruanoComunica.net,,View
11/08/2020 20:45,@JorgeRCombe,Jorge Combe,"#VotoDeConfianza El gabinete de Walter Martos recibió el voto de confianza. En total fueron 115 a favor, 5 en contra y 4 abstenciones. Frente Amplio votó dividido con cuatro en contra y una abstención.",1293363022468198400,,,,2,11,Twitter for Android,2316,1001,4,,19/12/2011,,,,,View
11/08/2020 20:45,@CelisBITW,Christian Celis,Esa izquierda del Frente Amplio y de UPP debe desaparecer del Perú. #VotoDeConfianza,1293362999995052032,,,,0,0,Twitter for Android,17,230,0,,16/05/2018,"Lima, Peru",Solo dime Celis.,,,View
11/08/2020 20:45,@flaminhott4,jennifer||🦋,El congreso otorga el voto de confianza a nuevo gabinete 115 a favor 5 en contra 4 abstenciones #VotoDeConfianza,1293362998908723205,,,,0,0,Twitter Web App,30,47,0,,26/05/2020,"Lima, Peru",Feminista💥.,,,View
11/08/2020 20:45,@M2Porcelanato,Rafael Castro,"#LoUltimo Como estaba previsto, el Congreso de la República, concede #VotoDeConfianza al Gabinete Martos.",1293362939894861824,,,,0,0,Twitter for Android,213,385,3,,9/06/2014,,"Proveedor de Porcelanato Selecto para Proyectos Residenciales, Comerciales e Industriales.",,,View
11/08/2020 20:45,@Petitee95,𝑺𝒆𝒂,"Gabinete Martos consiguió el voto de confianza, que pena que no hubo pijmada Merino. Con 115 votos a favor, 5 contra, 4 abstenciones #VotoDeConfianza",1293362900304891905,,,,0,1,Twitter for Android,360,2020,1,,8/10/2010,Peru,Amor amarillo... ✨,,,View
