,Twitter Query: #VotoDeConfianza lang:es -filter:retweets -filter:replies,,,,,,,,,,,,,,,,,,,
Date,Screen Name,Full Name,Tweet Text,Tweet ID,Link(s),Media,Location,Retweets,Favorites,App,Followers,Follows,Listed,Verfied,User Since,Location,Bio,Website,Timezone,Profile Image
12/08/2020 23:50,@Yeshuahqh,JRigo Quispe H,Es bien MEDIOCRE E IGNORANTE que este otro peón de @CesarAcunaP #FernandoMelendez...dice en @noticias_tvperu q le han dado un #VotodeConfianza a #Martos es un #ChequeenBlanco...y amenaza q si @MartinVizcarraC no hace lo q quiere este #Congreso2020 seguirán en su obstrucción,1293771907389587457,,,,0,0,Twitter for Android,469,1108,4,,29/03/2010,Lima-Perú,"Profesional en TI, enemigo de las injusticias y abusos...humilde desde mis raices..con valores y etica profesional...y vivo de mi trabajo honrado, Amo mi Perú.",,,View
12/08/2020 20:15,@MiguelA33585374,Miguel Angel Almeida,"#Elecciones2021Ec necesitamos administradores NO SALVADORES, #noolvidamos #politicos #AsambleaNacional corruptos antes y más en tiempos de #COVID19 tu #VotoDeConfianza hará la diferencia #EcuadorSinCorrupcion el cambio empieza desde nosotros.",1293717708614316034,,https://pbs.twimg.com/media/EfQ1ZmzXgAI2S73.jpg,,0,1,Twitter for Android,0,7,0,,2/08/2020,,"Lo normal, aunque esa apreciación depende de que tan normal sea de acuerdo a su medida.",,,View
12/08/2020 18:42,@ElioRodrguez15,Elio Rodríguez,"Más que un #VotoDeConfianza, el Perú necesita gente que conozca la realidad del día a día del peruano.",1293694269153312774,,,,0,0,Twitter Web App,4,81,0,,13/07/2020,,Estudio ingeniería industrial en la Pontificia Universidad Católica del Perú y soy actor en formación en la Escuela Nacional Superior de Arte Dramático,,,View
12/08/2020 18:04,@AGATHALYS,Agatha Lys,"Como lo adelantamos en video PBO Digital , Sí le dieron el #votodeconfianza al #PremierMartos .. “los Astros si estaban propicios” como lo dijimos . Recordando que #WalterMartos es nativo de Escorpio . Súper trabajador , pragmático y especialista en resolver problemas.",1293684835765149696,,https://pbs.twimg.com/media/EfQXf-tWAAAf3Xh.jpg,,0,1,Twitter for iPhone,14122,3499,41,,8/04/2010,Lima - Peru,"Vidente, Tarotista, Psicóloga, Sanadora Holística, Coach Life, Facilitadora de Talleres de Louise Hay, Periodista y Metafísica. Defensora de La Mujer. Marca 🔔",,,View
12/08/2020 17:04,@leivasport,Miguel Ángel Leiva,"Triste ver que ni Premier Martos, ni ningún Congresista o Bancada defiendan respeto a derechos y libertades individuales de ciudadanos. Más triste pensar que, nosotros tenemos el poder y elegimos prisión y no libertad. #VotoDeConfianza #WalterMartos #cuarentena @CARLOSMESIA",1293669664158097408,,,,0,0,Twitter for Android,485,1676,2,,12/06/2013,Lima - São Paulo,Legal & Sport Consulting Fútbol reflejo de Sociedad...,,,View
12/08/2020 15:26,@MarioEdgarRios,Mario Ríos,"¿Qué pasa con el #Gobierno? ¿Hasta cuándo seguiremos perdiendo familiares y amigos por falta de #oxígeno? ¡INTERVENCIÓN DEL ESTADO, URGENTE! El #VotoDeConfianza será en vano si no se gobierna al país de verdad.",1293645133540360194,https://bit.ly/2Fk6tnR,,,1,2,Twitter Web App,89,41,0,,30/06/2013,,Ser del mejor equipo del Perú,,,View
12/08/2020 15:07,@MonicaEagles,Mónica Sánchez,"Despues de haberse otorgado el #VotoDeConfianza al PCM, Confiamos en que ahora de piroridad al sector Salud para salir lo mas pronto de esta pandemia, que cumpla lo que ha pometido por el bien de nuestro país!! Si dice amar a nuestro pais, es hora de demostrarlo con hechos!!",1293640374041423873,,,,0,0,Twitter for Android,123,337,1,,5/01/2013,"Lima, Perú","Mujer Líder, Trabajadora, Luchadora, Abogada.Esposa y Madre de Familia.",,,View
12/08/2020 14:08,@jaimeasian,Jaime Asián,Conclusión luego del mensaje de Vizcarra: JUSTOS PAGAN POR PECADORES. #MartinVizcarra #NuevasMedidas #COVIDー19 #VotoDeConfianza #MensajePresidencial #Cuarentena #DomingoGuardados #Domingos,1293625423058870276,,,,0,0,Twitter Web App,1440,1949,15,,2/11/2010,"Lima, Perú.",Director del diario Ojo,http://www.ojo.pe,,View
12/08/2020 13:56,@jaimeasian,Jaime Asián,"Vizcarra: ""El domingo (pese a la inmovilización) sí se va a permitir el delivery"". #MartinVizcarra #NuevasMedidas #COVIDー19 #VotoDeConfianza #MensajePresidencial #Cuarentena",1293622449154789376,,,,0,0,Twitter Web App,1440,1949,15,,2/11/2010,"Lima, Perú.",Director del diario Ojo,http://www.ojo.pe,,View
12/08/2020 13:53,@jaimeasian,Jaime Asián,"Premier Martos también agradece al Congreso por el voto de confianza a su gabinete. ""No se puede amar a lo que no se conoce"". Romanticón el general. #MartinVizcarra #NuevasMedidas #COVIDー19 #VotoDeConfianza #MensajePresidencial #Cuarentena",1293621527003504640,,,,0,0,Twitter Web App,1440,1949,15,,2/11/2010,"Lima, Perú.",Director del diario Ojo,http://www.ojo.pe,,View
12/08/2020 13:50,@jaimeasian,Jaime Asián,"Vizcarra: ""Hablar de vacuna es hablar de los primeros meses de 2021"". #MartinVizcarra #NuevasMedidas #COVIDー19 #VotoDeConfianza #MensajePresidencial #Cuarentena #vacuna",1293620920016343043,,,,0,0,Twitter Web App,1440,1949,15,,2/11/2010,"Lima, Perú.",Director del diario Ojo,http://www.ojo.pe,,View
12/08/2020 13:49,@HallaziLuis,Luis Hallazi,"#VotoDeConfianza A dado confianza a Vizcarra, retoma el timón de lucha contra pandemia y ante incremento de contagio y muertes (200x día) volvemos a la #cuarentena obligatoria, sólo domingos en todo 🇵🇪.",1293620517291925507,,,,0,1,Twitter for Android,938,966,2,,12/10/2017,,"Abogado y politólogo, investigador en derechos humanos.",,,View
12/08/2020 13:48,@jaimeasian,Jaime Asián,"Vizcarra: ""Esto es una guerra con un enemigo invisible: Covid-19, y todos somos soldados. El éxito de este combate está en la responsabilidad de todos los peruanos"". #MartinVizcarra #NuevasMedidas #COVIDー19 #VotoDeConfianza #MensajePresidencial #Cuarentena",1293620382151380992,,,,0,0,Twitter Web App,1440,1949,15,,2/11/2010,"Lima, Perú.",Director del diario Ojo,http://www.ojo.pe,,View
12/08/2020 13:46,@MesasPrez,Mesías García P.,#ToqueDeQuedaLosDomingos! #Vizcarra salió con el pecho inflado nuevamente luego que @congresoperu aprobó #VotoDeConfianza a Premier Martos. La aprobación fue para #Martos;no para él. Que quede claro. @ExpresoPeru @WalterMartosR @PanoramaPTV @pcmperu @EsSaludPeru @reyconbarba,1293619981788291074,,,,0,0,Twitter for iPhone,419,1342,2,,26/10/2012,,Viajero de mundos. La cólera o el odio son como un anzuelo de un pescador. Es de vital importancia no morder ese anzuelo.,,,View
12/08/2020 13:44,@jaimeasian,Jaime Asián,"Vizcarra: ""Hagámozlo por las personas que más queremos"". #MartinVizcarra #NuevasMedidas #COVIDー19 #VotoDeConfianza #MensajePresidencial #Cuarentena",1293619484599685122,,,,0,0,Twitter Web App,1440,1949,15,,2/11/2010,"Lima, Perú.",Director del diario Ojo,http://www.ojo.pe,,View
12/08/2020 13:44,@jaimeasian,Jaime Asián,"Vizcarra: ""Tenemos que retroceder un paso... y desde este domingo volveremos a la inmovilización obligatoria a nivel nacional"". #MartinVizcarra #NuevasMedidas #COVIDー19 #VotoDeConfianza #MensajePresidencial #Cuarentena",1293619342719037449,,,,1,0,Twitter Web App,1440,1949,15,,2/11/2010,"Lima, Perú.",Director del diario Ojo,http://www.ojo.pe,,View
12/08/2020 13:41,@jaimeasian,Jaime Asián,"Vizcarra: ""Ahora el principal foco de contagio son nuestros familiares, amigos en las pichanguitas, parrilladas y quinceañeros"". #MartinVizcarra #NuevasMedidas #COVIDー19 #VotoDeConfianza #MensajePresidencial #Cuarentena",1293618672402149379,,,,1,0,Twitter Web App,1440,1949,15,,2/11/2010,"Lima, Perú.",Director del diario Ojo,http://www.ojo.pe,,View
12/08/2020 13:38,@jaimeasian,Jaime Asián,"Vizcarra: ""Estamos resaltando la prohibición de reuniones familiares"". #MartinVizcarra #NuevasMedidas #COVIDー19 #VotoDeConfianza #MensajePresidencial #Cuarentena",1293617799944970242,,,,0,0,Twitter Web App,1440,1949,15,,2/11/2010,"Lima, Perú.",Director del diario Ojo,http://www.ojo.pe,,View
12/08/2020 13:35,@jaimeasian,Jaime Asián,"Vizcarra: ""Ingresan a cuarentena 5 departamentos y 34 provincias"". #MartinVizcarra #NuevasMedidas #COVIDー19 #VotoDeConfianza #MensajePresidencial",1293617224117374977,,,,0,0,Twitter Web App,1440,1949,15,,2/11/2010,"Lima, Perú.",Director del diario Ojo,http://www.ojo.pe,,View
12/08/2020 13:34,@jaimeasian,Jaime Asián,"Vizcarra: ""En julio se ha visto un rebrote y eso se debe a que hemos debilitado nuestras acciones para evitar el contagio"". #MartinVizcarra #NuevasMedidas #COVIDー19 #VotoDeConfianza #MensajePresidencial",1293616874836680705,,,,0,0,Twitter Web App,1440,1949,15,,2/11/2010,"Lima, Perú.",Director del diario Ojo,http://www.ojo.pe,,View
12/08/2020 13:28,@jaimeasian,Jaime Asián,"Vizcarra: ""Tenemos que garantizar el cumplimiento del distanciamiento social con operativos"". #MartinVizcarra #NuevasMedidas #COVIDー19 #VotoDeConfianza #MensajePresidencial",1293615396738797568,,,,0,0,Twitter Web App,1440,1949,15,,2/11/2010,"Lima, Perú.",Director del diario Ojo,http://www.ojo.pe,,View
12/08/2020 13:27,@jaimeasian,Jaime Asián,"Vizcarra: ""Hemos tenido errores en todo este proceso de enfrentar a la Pandemia"". #MartinVizcarra #NuevasMedidas #COVIDー19 #VotoDeConfianza",1293614984572866563,,,,0,1,Twitter Web App,1440,1949,15,,2/11/2010,"Lima, Perú.",Director del diario Ojo,http://www.ojo.pe,,View
12/08/2020 13:21,@bobsparz,Roberto Esparza 🇵🇪,Voy a decir algo impopular: me parece bien que no le hayan dado el #VotoDeConfianza a Pedro Cateriano.,1293613568190021632,,,,0,1,Twitter Web App,3191,954,146,,21/07/2009,Lima Perú,Cantautor / Comunicador para el Desarrollo / Márketing Digital / Intolerante a la hipocresía / Chilcanolover / Pizza con Piña / Solo me siguen los valientes,http://soundcloud.com/roberto-esparza,,View
12/08/2020 13:20,@xtopheracevedo,Chrístopher Acevedo,#AHORA Pronunciamiento del presidente del República @MartinVizcarraC tras el #VotoDeConfianza al gabinete Martos. Queda claro que la propuesta de #Cateriano fue un rotundo error. #Política #Perú,1293613467400896513,,,,0,0,Twitter for Android,1088,216,13,,3/03/2010,Tacna Perú,"MBA. Comunicador social, académico, columnista, servidor público y orgulloso padre!",,,View
12/08/2020 13:20,@jeremyfalconf,Jeremy Falcón Flores,#ConferenciaPresidente #Cuarentena Vizcarra: quiero empezar saludando la decisión del congreso de la república al dar el #VotoDeConfianza (sobre la cuestión de confianza al gabinete Martos).,1293613233845276672,,https://pbs.twimg.com/media/EfPWYARXgAE0uVp.jpg,,0,0,Twitter for Android,42,249,0,,19/10/2018,"Lima, Peru","peruano por siempre 🇵🇪, amo por siempre la música 🎶 y las noticias 📰 me gustan los retos y conseguir mis sueños y el éxito. #QuedateEnCasa",,,View
12/08/2020 13:16,@CalebSegundo,Segundo Caleb Ruiz Ramos,"Toma tu confianza, pero no te olvides que nos debes 3 caballitos de Batalla, Uno para AP, otro para APP, y otro para Podemos. #VotoDeConfianza #PeruEstaEnNuestrasManos #Peru",1293612414911623168,,,,0,0,Twitter Web App,18,26,0,,2/01/2014,"San Martin, Juanjui ","Peruano. Líder, educador conferencista .",,,View
12/08/2020 13:12,@DheysRios,Dheys Rios Acosta,"Palabras finales de Walter Martos @WalterMartosR antes de recibir el #VotoDeConfianza del @congresoperu (1/2) ""...venimos en la mañana con el gabinete a pedir la unidad por las graves dificultades y el tremendo dolor que está viviendo el pueblo peruano...""",1293611286908088321,,pic.twitter.com/HEcmVbqMtT,,1,0,Twitter for Android,216,3631,18,,16/06/2012,Lima,Ñuqa Dheysmi Kani,,,View
12/08/2020 13:10,@yturbe_,Ricardo Yturbe,"Ahora que ya acabo la novela #VotoDeConfianza, podemos hablar de cosas serias como: Los contratos del papá de Alva con el estado, Richard Swing, los cuñados, concuñados, sobrinos y compadres de Vizcarra y Mirian Morales? Ya podemos?",1293610814239322117,,,,23,47,Twitter for iPhone,8401,3657,33,,5/07/2009,"Lima, Peru","Abogado, político y activista de la justicia social. Sec. Nacional de Agrupaciones Profesionales del @APRA_Oficial CEO de @PublicoPeru",http://www.facebook.com/ryturbe,,View
12/08/2020 12:14,@1FelipeCastillo,Felipe Castillo,Recibimos a los dirigentes @Minsa_Peru y @EsSaludPeru que están luchando por su pase de Cas a 728 y 276 junto al Pdte del @congresoperu @MerinoDeLama Exigimos se ponga a debate dichos PL #CasNuncaMasEnEssalud @CNNEE #VotoDeConfianza @sunessessalud @SIPSSAPMINSA @FEDEMINSAP2,1293596789669605384,,https://pbs.twimg.com/media/EfPHaiVXYA8OPCS.jpg,,28,20,Twitter for iPhone,1152,449,11,,17/07/2012,"Los Olivos, Lima, Peru",Congresista electo del Peru 🇵🇪 Impulsor y Promotor del Desarrollo de Lima Norte,,,View
12/08/2020 11:33,@stereovilla_ves,Radio Stereo Villa,"🔴#VotoDeConfianza| El presidente de la República, Martín Vizcarra, saludó el voto de confianza obtenido por Walter Martos.",1293586530380980232,http://stereovilla.pe/congreso-otorgo-voto-de-confianza-a-gabinete-de-walter-martos/,,,0,0,Twitter Web App,1271,714,14,,1/06/2011,Perú,"Somos radio Stereo Villa de Villa El Salvador, la radio musical e informativa de Lima Sur. 📻 #StereoVilla 107.7 Fm. Suena Mejor! 🎵🎧",http://stereovilla.pe/,,View
12/08/2020 11:33,@MiguelHilarioE,Miguel Hilario,Un día después del #VotoDeConfianza 🤣 RT @MariaCespedesc: #ALERTA El @MineduPeru ha publicado la R.M.N° 298-2020 . Uno de los puntos del documento permitirá a los colegios privados subir las pensiones mensuales hasta antes de la fecha de matrícula.,1293586375221092352,https://twitter.com/MariaCespedesc/status/1293566265794199552,https://pbs.twimg.com/media/EfOXbHFWoAYp5ad.jpg,,1,0,Twitter for Android,5165,1013,26,,8/07/2010,Perú,"Miguel Hilario, Impulsando un #PerúPluralista abriendo #UnNuevoCamino. Antropólogo, Economista y Politólogo. Shipibo-Conibo graduado en Stanford y Oxford.",http://www.miguelhilario.com/,,View
12/08/2020 11:18,@MiningPress,MiningPress,Mining Press | Nuevo canon Minero: El proyecto de Martos  #canon #VotoDeConfianza @MinemPeru,1293582516872343556,https://bit.ly/2PNBzGh,https://pbs.twimg.com/media/EfORPjtXkAEWDRJ.png,,0,0,Twitter Web App,5627,3686,79,,14/08/2011,"Buenos Aires, Lima, Santiago",Mining Press y EnerNews son diarios on line especializados en Minería y en Energía. In: https://bit.ly/2KAYsux,http://www.miningpress.com,,View
12/08/2020 11:12,@manoalzadalima,Mano Alzada,"#Congreso le otorgó el #VotoDeConfianza al gabinete que preside Walter Martos: 115 a favor, 5 en contra y 4 abstenciones para un discurso que cambió las formas, pero conserva el fondo de la dirección del #Ejecutivo.",1293581117874995200,,https://pbs.twimg.com/media/EfO5KfSXkAMgIAm.jpg,,0,0,Twitter for iPhone,4737,4613,21,,30/01/2018,"Lima, Peru",Medio de comunicación alternativo y autogestionado orgullosamente independiente.,http://manoalzada.pe,,View
12/08/2020 10:55,@Agencia_Andina,Agencia Andina,"👉Presidente Martín Vizcarra lidera una nueva sesión del Consejo de Ministros, tras el #VotoDeConfianza que el Congreso le otorgó en la víspera al Gabinete Ministerial",1293576793044258826,https://bit.ly/2XWd12p,https://pbs.twimg.com/media/EfO06gTXsAAZpn2.jpg,,0,1,Twitter Web App,613800,1681,2150,✅,18/05/2009,Lima,Sigue las noticias sobre Perú y el mundo en la Agencia Peruana de Noticias Andina. También puedes seguir a @DiarioElPeruano #PrimeroMiSalud y #LávateLasManos,http://www.andina.pe,,View
12/08/2020 10:17,@judithdelamata,Judith de la Mata,"🤔 Ojalá que @MartinVizcarraC sepa aprovechar inteligentemente bien del país, el #VotoDeConfianza que ha otorgado el @congresoperu a su gabinete. RT @pcmperu: Con 115 votos a favor, el @congresoperu otorgó el #VotoDeConfianza al Gabinete Ministerial presidido por @WalterMartosR, quien presentó la política general de Gobierno ante la representación nacional. #ElPerúPrimero",1293567337543720965,https://twitter.com/pcmperu/status/1293377888893493248,https://pbs.twimg.com/media/EfL_utVXoAAybig.jpg,,0,0,Twitter for iPhone,141,97,0,,12/07/2020,"Lima, Peru","Abogada, docente y política peruana. Miembro del Partido Aprista Peruano, fui congresista por Lima desde el 2001 hasta el 2006.",,,View
12/08/2020 10:07,@virgilio_acuna,Virgilio Acuña,El #votodeconfianza al gabinete de @WalterMartos no significa olvidarse de la destrucción económica y ética que hizo la empresa #Odebrecht,1293564739050774528,,,,2,2,Twitter for iPhone,9164,394,69,,25/06/2010,Peru,"Ingeniero, político, excongresista del Perú. Comprometido con el desarrollo digital y la creatividad para abrir horizontes.",,,View
12/08/2020 10:05,@ImpulsoPais,Impulso País,"⚠️ #VotoDeConfianza #LoÚltimo Con 115 votos a favor, 5 en contra y 4 abstenciones, el @congresoperu otorga la confianza al gabinete presidido por Walter Martos (@WalterMartosR). Fuente: Transmisión en vivo del pleno virtual del Congreso vía CongresoTV ▶️",1293564312821411843,,https://pbs.twimg.com/media/EfOpwG9XgAUtqb-.jpg,,4,5,Twitter Web App,5514,106,9,,28/07/2018,Peru,"Asociación civil sin fines de lucro 🇵🇪 Aprender, enseñar, hacer y compartir 🙌",https://www.facebook.com/impulsopais/,,View
12/08/2020 09:57,@peruenlanoticia,#Noticias #Perú🇵🇪😷☣️,Martín Tanaka: Los problemas del Gobierno tienen que ver con la implementación de sus políticas  #votodeconfianza #WalterMartos,1293562270945927169,http://dlvr.it/RdVxyQ,https://pbs.twimg.com/media/EfOoB8wVAAAJTzS.jpg,,1,0,dlvr.it,55304,12650,256,,17/02/2014,#PERÚ / EUROPA / #ASIA / LatAm,#AlertaNoticias #Trump #Covid #AFP #Odebrecht #Política @elcomercio_peru @CanalN_ @larepublica_pe @rppnoticias,https://twitter.com/peruenlanoticia,,View
12/08/2020 09:17,@FrancoChamo,Franco Chamochumbi,"Como siempre @ocram super claro en #LaEncerrona Ahora sobre la carrera de la vacuna y el humo echan en el camino, por ejemplo Putin anunciando su vacuna que recién está en fase 1. También el curioso #VotoDeConfianza y la crisis de oxígeno",1293552181111656449,https://www.youtube.com/watch?v=0iSAQfgNTsE,,,2,0,Twitter Web App,237,482,3,,1/01/2010,Lima,"Políticamente comprometido con mi país, se busca partido afín. Convencido total del poder de una buena educación y la necesidad de mejorarla en Perú y Latam",,,View
12/08/2020 09:12,@stereovilla_ves,Radio Stereo Villa,"🔵 #VotoDeConfianza| Juan De La Puente: ""Tengo la sensación que los adversarios cansados se han abrazado pero la tensión creo que continúa. Este rebote de los 115 votos lo que hace es construir un consenso pequeño al interior una crisis muy grande"". ➡",1293550989992173568,https://cutt.ly/kd04zg2,https://pbs.twimg.com/media/EfOdwGJWsAAhqCH.jpg,,0,1,Twitter Web App,1271,714,14,,1/06/2011,Perú,"Somos radio Stereo Villa de Villa El Salvador, la radio musical e informativa de Lima Sur. 📻 #StereoVilla 107.7 Fm. Suena Mejor! 🎵🎧",http://stereovilla.pe/,,View
12/08/2020 09:06,@DiarioElPeruano,Diario El Peruano,"📍 Consejo de Ministros obtuvo el #VotoDeConfianza del Congreso luego de escuchar y debatir la política general de gobierno expuesta por el jefe del Gabinete Ministerial, Walter Martos  ➡Voceros parlamentarios resaltan exposición del plan de gobierno",1293549512590536714,https://bit.ly/2PRZJPT,https://pbs.twimg.com/media/EfOcK8cXkAEC5Wz.jpg,,2,8,TweetDeck,227505,326,511,✅,14/10/2015,Peru,Cuenta del Diario Oficial El Peruano y las #NormasLegales. Sigue también @agencia_andina #PrimeroMiSalud y #LávateLasManos,http://www.elperuano.pe,,View
12/08/2020 09:04,@CanalHsj,Vil Oficio en la Mira🔭,"Pueden informar si Vicente Zeballos aun sigue en Palacio...? 🤔 De ser así, el @congresoperu solo le habría dado un #VotoDeConfianza a un Gabinete REVUELTO.. 😡 RT @PanamericanaTV: #EnVivo | Presidente Vizcarra saludó voto de confianza a Gabinete Martos. Míranos EN VIVO ►  #PanamericanaNoticias #Bdp",1293548916894564354,"https://twitter.com/PanamericanaTV/status/1293531948275695618
http://ptv.pe/vivo",https://pbs.twimg.com/media/EfOMc7QWoAASAB-.jpg,,0,0,Twitter for Android,103,384,0,,4/10/2019,,"Para mi una izquierda, centro o derecha Decente, es la que se aparta del comunismo rabioso y se apesta de los Caviares y Hueveras..🤧",,,View
12/08/2020 08:49,@HernanR19444885,Rafael - Hernan,"Simplemetente tratan temas de economía y siempre a favor de las grandes empresas, pero hasta el momento no sabemos los peruanos cuales serán las estrategia en el sistema salud. #VotoDeConfianza #WalterMartos",1293545075151175682,,,,0,0,Twitter for Android,130,1334,0,,27/03/2019,,La politica es psiquica y de mucha paciencia ... si le das muchas vueltas te volveras loco .,,,View
12/08/2020 08:31,@Agencia_Andina,Agencia Andina,"📌Jefe del Gabinete Ministerial, Walter Martos, formuló diversos anuncios durante su presentación ante el Congreso, en la que expuso su política general de Gobierno y se le otorgó el #VotoDeConfianza. Estos son los más importantes👉",1293540569399070720,https://bit.ly/3kNkJpw,https://pbs.twimg.com/media/EfOT_P9XkAALriB.jpg,,2,1,Twitter Web App,613776,1681,2150,✅,18/05/2009,Lima,Sigue las noticias sobre Perú y el mundo en la Agencia Peruana de Noticias Andina. También puedes seguir a @DiarioElPeruano #PrimeroMiSalud y #LávateLasManos,http://www.andina.pe,,View
12/08/2020 08:30,@manuelaguilarap,Manuel Aguilar,"El #VotoDeConfianza al Gabinete que encabeza el presidente del Consejo de Ministro, @WalterMartosR; busca aunar esfuerzos para trabajar en soluciones inmediatas que la población hoy necesita, el desarrollo de nuestro país debe seguir. #BancadaAcciónPopular #ManuelAguilar",1293540390885351424,,https://pbs.twimg.com/media/EfOUICjWsAcwojh.jpg,,1,1,Twitter for Android,158,30,4,,16/03/2020,San Martín,"Congresista de la República del Perú, para el periodo 2020 - 2021 por la Región San Martín.",,,View
12/08/2020 08:14,@coyotegris,Erick Iriarte Ahon,".@WalterMartosR felicitaciones por el #votodeconfianza recibido, es una responsabilidad sin duda critica en estos tiempos. De manera transversal, y como sustento, el tema digital se encontró en su discurso. Necesario para lograr un #perudigital, pero (...) 1/2",1293536446356361216,,,,0,0,Twitter Web App,16468,8525,509,,12/06/2009,,Un coyote en busqueda de su desierto.,http://iriartelaw.com,,View
12/08/2020 08:10,@MiningPress,MiningPress,"Mining Press | EnerNews | Martos ya es premier peruano. Estrategias de inversión, obra pública y empleo  @pcmperu #martos #VotoDeConfianza #Perú @MEF_Peru",1293535362208468992,https://bit.ly/2Fi5Xqt,https://pbs.twimg.com/media/EfOPg1xXgAAgXPF.png,,0,0,Twitter Web App,5627,3686,79,,14/08/2011,"Buenos Aires, Lima, Santiago",Mining Press y EnerNews son diarios on line especializados en Minería y en Energía. In: https://bit.ly/2KAYsux,http://www.miningpress.com,,View
12/08/2020 07:51,@TendenciaPe,¿Por que es Tendencia_Pe?,#VotoDeConfianza #GabineteMartos: Porque el Congreso le otorgó el Voto de Confianza al gabinete liderado por Walter Martos,1293530435847364608,,pic.twitter.com/3JUPZzSW1m,,0,1,Twitter Web App,4790,15,7,,16/12/2019,Tendencias-Peru,Entérate porque es tendencia en Perú #TwitterPeru,,,View
12/08/2020 07:15,@exitosape,Exitosa Noticias,"🇵🇪📣 Ministra de #Economía, María Antonieta Alva, agradeció al #Congreso por otorgar el #VotoDeConfianza al Gabinete Ministerial presidido por #WalterMartos. @ToniAlvaL @congresoperu",1293521548456923138,https://exitosanoticias.pe/v1/ministra-alva-tras-voto-de-confianza-reafirmamos-nuestra-voluntad-de-sumar-esfuerzos-por-el-pais/,,,1,8,Twitter Web App,397709,753,681,,20/11/2013,"Lima, Peru",La plataforma de medios informativos más grande del Perú 📻,http://www.exitosanoticias.pe,,View
12/08/2020 07:14,@Agencia_Andina,Agencia Andina,"📌Ministra de Economía y Finanzas, María Antonieta Alva, agradeció el #VotoDeConfianza que el Congreso otorgó al Gabinete Ministerial que preside Walter Martos, e hizo un llamado al trabajo conjunto para detener la pandemia",1293521218960850945,https://bit.ly/2DNBtfr,https://pbs.twimg.com/media/EfOCXu_XgAAW_xY.jpg,,0,22,Twitter Web App,613765,1681,2150,✅,18/05/2009,Lima,Sigue las noticias sobre Perú y el mundo en la Agencia Peruana de Noticias Andina. También puedes seguir a @DiarioElPeruano #PrimeroMiSalud y #LávateLasManos,http://www.andina.pe,,View
12/08/2020 07:07,@fernandomerino,"Sr. Cerdazzo, el Tecnomago","¡Buen día, buen día! ¿Cómo vamos, en su casa también tienen el #VotoDeConfianza o los quieren botar como sofá viejo?",1293519441037328384,,,,0,2,Twitter for Android,3317,4994,72,,8/02/2009,Global Frequency. Asgardia,IT Support - DJ Transhumanismo Investigador musical-tecnológico Arqueólogo pop - Gamer Defensor de la comida chatarra Basket - Sci-fi - Comics #ActivismoPorno,,,View
12/08/2020 07:05,@Cixalminuto,Chiclayo al Minuto,"El Ministerio del Interior consideró que el #VotoDeConfianza al gabinete del premier Walter Martos permitirá que 600 comisarías de 10 ciudades (Lima, Callao, Tumbes, Cajamarca, Piura, Chiclayo, Trujillo, Arequipa,…",1293518935942287366,https://www.instagram.com/p/CDyeK45nMto/?igshid=17njmo4hyjtht,,,0,0,Instagram,343,30,1,,14/05/2017,Chiclayo,,,,View
12/08/2020 06:30,@elmontonero_pe,El Montonero,#PoliticaEM #ElMontonero Silencio frente a inversión privada como motor de crecimiento Síguenos en: FB:  Youtube:  Más Artículos:  #WalterMartos #VotoDeConfianza #CongresoDeLaRepublica,1293510040855420928,"http://bit.ly/2s7hI97
http://bit.ly/2R1CNRo
http://bit.ly/2TkXynO
https://bit.ly/3aoKveY",,,0,0,Twitter for Advertisers,23042,1615,104,,19/03/2014,"Lima, Perú.",El primer portal de opinión del Perú.,http://www.elmontonero.pe,,View
